;title;link;image_link;duration;status;aired;episodes;type;source;genres;themes;demographic;producers;studios;licensors;voice_actors;staffs;score;ranked;rating;favorites;popularity;members;platforms;synopsis;synonyms;japanese
0;Neon Genesis Evangelion;https://myanimelist.net/anime/30/Neon_Genesis_Evangelion;https://cdn.myanimelist.net/resources/mxj_panel/2022/20221116_paralive_club_event.png;24 min. per ep.;Finished Airing;Oct 4, 1995 to Mar 27, 1996;26;TV;Original;['Action', 'Avant Garde', 'Award Winning', 'Drama', 'Sci-Fi', 'Suspense'];['Mecha', 'Psychological'];NOT_EXIST;['TV Tokyo', 'Kadokawa Shoten', 'Nihon Ad Systems', 'Audio Tanaka'];Gainax, Tatsunoko Production;ADV Films, GKIDS;['Miyamura, Yuko', 'Ogata, Megumi', 'Hayashibara, Megumi', 'Mitsuishi, Kotono', 'Ishida, Akira', 'Hayashibara, Megumi', 'Tachiki, Fumihiko', 'Yamadera, Kouichi', 'Yamaguchi, Yuriko', 'Seki, Tomokazu'];[{'name': 'Anno, Hideaki', 'role': 'Producer, Director, Script, Storyboard, Key Animation, Creator, Mechanical Design'}, {'name': 'Yamaga, Hiroyuki', 'role': 'Producer'}, {'name': 'Kobayashi, Noriko', 'role': 'Producer'}, {'name': 'Takahashi, Tomoko', 'role': 'Assistant Producer'}];8.34;#212;PG-13 - Teens 13 or older;98,961;#45;1,690,072;['Netflix'];"Fifteen years after a cataclysmic event known as the Second Impact, the world faces a new threat: monstrous celestial beings called ""Angels"" invade Tokyo-3 one by one. Mankind is unable to defend themselves against the Angels despite utilizing their most advanced munitions and military tactics. The only hope for human salvation rests in the hands of NERV, a mysterious organization led by the cold Gendou Ikari. NERV operates giant humanoid robots dubbed ""Evangelions"" to combat the Angels with state-of-the-art advanced weaponry and protective barriers known as Absolute Terror Fields.  Years after being abandoned by his father, Shinji Ikari, Gendou's 14-year-old son, returns to Tokyo-3. Shinji undergoes a perpetual internal battle against the deeply buried trauma caused by the loss of his mother and the emotional neglect he suffered at the hands of his father. Terrified to open himself up to another, Shinji's life is forever changed upon meeting 29-year-old Misato Katsuragi, a high-ranking NERV officer who shows him a free-spirited maternal kindness he has never experienced.  A devastating Angel attack forces Shinji into action as Gendou reveals his true motive for inviting his son back to Tokyo-3: Shinji is the only child capable of efficiently piloting Evangelion Unit-01, a new robot that synchronizes with his biometrics. Despite the brutal psychological trauma brought about by piloting an Evangelion, Shinji defends Tokyo-3 against the angelic threat, oblivious to his father's dark machinations.  [Written by MAL Rewrite]";Shinseiki Evangelion;新世紀エヴァンゲリオン
1;Devilman: Crybaby;https://myanimelist.net/anime/35120/Devilman__Crybaby;https://cdn.myanimelist.net/resources/mxj_panel/2023/20230313192021_20230315_ec-kimetsu-world-tour.jpg;25 min. per ep.;Finished Airing;Jan 5, 2018;10;ONA;Manga;['Action', 'Avant Garde', 'Horror', 'Supernatural'];['Gore', 'Mythology'];Shounen;['Aniplex', 'Dynamic Planning', 'Netflix'];Science SARU;None found, add some;['Murase, Ayumu', 'Uchiyama, Kouki', 'Uchiyama, Kouki', 'Han, Megumi', 'Murase, Ayumu', 'Koshimizu, Ami', 'KEN THE 390', 'Young Dais', 'Tanaka, Atsuko'];[{'name': 'Choi, Eun-Young', 'role': 'Producer'}, {'name': 'Yuasa, Masaaki', 'role': 'Director, Episode Director, Storyboard, Key Animation'}, {'name': 'Kimura, Eriko', 'role': 'Sound Director'}, {'name': 'Oshiyama, Kiyotaka', 'role': 'Episode Director, Storyboard, Animation Director, Character Design, Key Animation'}];7.76;#1003;R+ - Mild Nudity;22,716;#129;1,064,217;['Netflix'];Devils cannot take form without a living host. However, if the will of an individual is strong enough, they can overcome the demon and make its power their own, becoming a Devilman.  Weak and unassuming, Akira Fudou has always had a bleeding heart. So when his childhood friend Ryou Asuka asks for his help in uncovering devils, Akira accepts without hesitation. However, to Akira's surprise, the place they go to is Sabbath: an immoral party of debauchery and degeneracy. Amidst bloodshed and death, demons possess the partiers, turning their bodies into grotesque monsters, and begin wreaking havoc. In a reckless attempt to save his best friend, Akira unwittingly merges with the devil Amon and becomes a Devilman, gaining the power to defeat the remaining demons.  Though it grants him great power, this new partnership awakens an insatiable and primeval part of Akira. Having the body of a devil but the same crybaby heart, Akira works alongside Ryou, destroying those that harm humanity and his loved ones.  [Written by MAL Rewrite];NOT_EXIST;DEVILMAN crybaby
2;Neon Genesis Evangelion: The End of Evangelion;https://myanimelist.net/anime/32/Neon_Genesis_Evangelion__The_End_of_Evangelion;https://cdn.myanimelist.net/resources/mxj_panel/2022/20221116_paralive_club_event.png;1 hr. 26 min.;Finished Airing;Jul 19, 1997;1;Movie;Original;['Avant Garde', 'Drama', 'Sci-Fi'];['Mecha', 'Psychological'];NOT_EXIST;['TV Tokyo', 'Toei Animation', 'Kadokawa Shoten', 'Movic', 'Sega', 'TV Tokyo Music', 'Audio Tanaka'];Gainax, Production I.G;GKIDS, Manga Entertainment;['Miyamura, Yuko', 'Ogata, Megumi', 'Hayashibara, Megumi', 'Mitsuishi, Kotono', 'Ishida, Akira', 'Hayashibara, Megumi', 'Tachiki, Fumihiko', 'Yamadera, Kouichi', 'Yamaguchi, Yuriko', 'Nagasawa, Miki'];[{'name': 'Tsurumaki, Kazuya', 'role': 'Co-Director'}, {'name': 'Ishikawa, Mitsuhisa', 'role': 'Producer'}, {'name': 'Anno, Hideaki', 'role': 'Director, Storyboard, Theme Song Lyrics, Music, Key Animation, Creator, Animation Director, Screenplay, Mechanical Design'}, {'name': 'Tanaka, Hideyuki', 'role': 'Sound Director'}];8.55;#102;R+ - Mild Nudity;26,786;#178;863,482;['Netflix'];Shinji Ikari is left emotionally comatose after the death of a dear friend. With his son mentally unable to pilot the humanoid robot Evangelion Unit-01, Gendou Ikari's NERV races against the shadow organization SEELE to see who can enact their ultimate plan first. SEELE desires to create a godlike being by fusing their own souls into an Evangelion unit, while Gendou wishes to revert all of humanity into one primordial being so that he can be reunited with Yui, his deceased wife.  SEELE unleashes its military forces in a lethal invasion of NERV headquarters. As SEELE's forces cut down NERV's scientists and security personnel, Asuka Langley Souryuu pilots Evangelion Unit-02 in a desperate last stand against SEELE's heaviest weaponry.  The battle rages on, and a depressed Shinji hides deep within NERV's headquarters. With the fate of the world resting in Shinji's hands, Captain Misato Katsuragi hunts for the teenage boy as society crumbles around them.  [Written by MAL Rewrite];Shinseiki Evangelion Gekijouban: The End of Evangelion;新世紀エヴァンゲリオン劇場版 THE END OF EVANGELION
3;FLCL;https://myanimelist.net/anime/227/FLCL;https://cdn.myanimelist.net/resources/mxj_panel/2023/20230322230404_20230329_readmanga_1.png;25 min. per ep.;Finished Airing;Apr 26, 2000 to Mar 16, 2001;6;OVA;Original;['Action', 'Avant Garde', 'Comedy', 'Sci-Fi'];['Mecha', 'Parody', 'Psychological'];NOT_EXIST;['Starchild Records', 'GANSIS'];Gainax, Production I.G;Funimation, Synch-Point;['Shintani, Mayumi', 'Kasagi, Izumi', 'Mizuki, Jun', 'Itou, Mika', 'Mizuki, Jun', 'Ohkura, Kouji', 'Chiba, Chiemi', 'Matsuo, Suzuki', 'Anno, Hideaki'];[{'name': 'Satou, Hiroki', 'role': 'Producer'}, {'name': 'Tsurumaki, Kazuya', 'role': 'Director, Storyboard, Key Animation, Creator, Planning'}, {'name': 'Ootsuka, Masahiko', 'role': 'Episode Director'}, {'name': 'Saeki, Shouji', 'role': 'Episode Director, Storyboard, In-Between Animation, Key Animation'}];8.03;#543;PG-13 - Teens 13 or older;28,528;#219;776,559;['Funimation'];Naota Nandaba is an ordinary sixth grader living in a city where nothing amazing ever seems to happen. After his brother Tasuku leaves town to play baseball in America, Naota takes it upon himself to look after everything Tasuku left behind—from his top bunk bed to his ex-girlfriend Mamimi Samejima, who hasn't stopped clinging to Naota since Tasuku left.  Little does Naota know, however, that his mundane existence is on the verge of being changed forever: enter Haruko Haruhara, a Vespa-riding, bass guitar-wielding, pink-haired psychopath whose first encounter with Naota leaves him with tire tracks on his back and a giant horn on his head. Though all he wants is some peace and quiet, when Haruko takes up residence at his parents' home, Naota finds himself dragged into the heart of the greatest battle for supremacy that Earth—and quite possibly the entire universe—has ever seen.  [Written by MAL Rewrite];Fooly Cooly, Furi Kuri;フリクリ
4;Serial Experiments Lain;https://myanimelist.net/anime/339/Serial_Experiments_Lain;https://cdn.myanimelist.net/resources/mxj_panel/2022/20221116_paralive_club_event.png;23 min. per ep.;Finished Airing;Jul 6, 1998 to Sep 28, 1998;13;TV;Original;['Avant Garde', 'Award Winning', 'Drama', 'Mystery', 'Sci-Fi', 'Supernatural'];NOT_EXIST;NOT_EXIST;['TV Tokyo', 'Geneon Universal Entertainment', 'Genco', 'Pioneer LDC', 'TV Tokyo Music', 'Fujipacific Music'];Triangle Staff;Funimation, Geneon Entertainment USA;['Shimizu, Kaori', 'Asada, Yoko', 'Hayami, Show', 'Oobayashi, Ryuusuke', 'Nakata, Jouji', 'Mutou, Sumi', 'Kawasumi, Ayako', 'Takimoto, Keito', 'Chikada, Wasei', 'Yamazaki, Takumi'];[{'name': 'Ueda, Yasuyuki', 'role': 'Producer, Original Creator, Planning'}, {'name': 'Maseba, Yutaka', 'role': 'Producer'}, {'name': 'Nakamura, Ryuutarou', 'role': 'Director, Episode Director, Storyboard'}, {'name': 'Ueda, Shigeru', 'role': 'Director'}];8.08;#493;R - 17+ (violence & profanity);24,916;#253;702,658;['Crunchyroll', 'Funimation'];"Lain Iwakura, an awkward and introverted fourteen-year-old, is one of the many girls from her school to receive a disturbing email from her classmate Chisa Yomoda—the very same Chisa who recently committed suicide. Lain has neither the desire nor the experience to handle even basic technology; yet, when the technophobe opens the email, it leads her straight into the Wired, a virtual world of communication networks similar to what we know as the internet. Lain's life is turned upside down as she begins to encounter cryptic mysteries one after another. Strange men called the Men in Black begin to appear wherever she goes, asking her questions and somehow knowing more about her than even she herself knows. With the boundaries between reality and cyberspace rapidly blurring, Lain is plunged into more surreal and bizarre events where identity, consciousness, and perception are concepts that take on new meanings.  Written by Chiaki J. Konaka, whose other works include Texhnolyze, Serial Experiments Lain is a psychological avant-garde mystery series that follows Lain as she makes crucial choices that will affect both the real world and the Wired. In closing one world and opening another, only Lain will realize the significance of their presence.  [Written by MAL Rewrite]";NOT_EXIST;シリアルエクスペリメンツレイン
5;Perfect Blue;https://myanimelist.net/anime/437/Perfect_Blue;https://cdn.myanimelist.net/resources/mxj_panel/2023/20230313192021_20230315_ec-kimetsu-world-tour.jpg;1 hr. 21 min.;Finished Airing;Feb 28, 1998;1;Movie;Novel;['Avant Garde', 'Drama', 'Horror'];['Adult Cast', 'Psychological', 'Showbiz'];NOT_EXIST;['Rex Entertainment', 'ONIRO'];Madhouse;GKIDS, Manga Entertainment;['Iwao, Junko', 'Ookura, Masaaki', 'Matsumoto, Rica', 'Hori, Hideyuki', 'Ebara, Masashi', 'Niiyama, Shiho', 'Yanada, Kiyoyuki'];[{'name': 'Maruyama, Masao', 'role': 'Producer'}, {'name': 'Maseba, Yutaka', 'role': 'Producer'}, {'name': 'Inoue, Hiroaki', 'role': 'Producer'}, {'name': 'Kon, Satoshi', 'role': 'Director, Script, Character Design'}];8.54;#105;R+ - Mild Nudity;17,242;#295;636,667;[];"J-pop idol group CHAM! has spent the last two years entertaining its fans. Sadly, all good things must come to an end, and CHAM! must see one of its members, Mima Kirigoe, leave the group to pursue her acting career. While Mima's choice is met with a mixed response, she hopes her fans will continue to support her.  However, Mima's life begins to change drastically after her departure from the group. Wanting to shed her pop-idol image, she takes on a role in a crime drama series, and her career as an actress gradually becomes more demanding and taxing for both Mima and her manager, Rumi Hidaka. To add to Mima's growing unease, an obsessed fan who is incapable of accepting that Mima has quit being an innocent idol, begins stalking her; a new anonymous website begins to impersonate her life with intricate detail; and CHAM! also appears to be doing better without her. One by one, each disturbing development drives Mima to become increasingly unhinged and unable to distinguish reality from fantasy.  [Written by MAL Rewrite]";NOT_EXIST;パーフェクトブルー
6;Paprika;https://myanimelist.net/anime/1943/Paprika;https://cdn.myanimelist.net/resources/mxj_panel/2023/20230322230531_20230329_readmanga_2.png;1 hr. 30 min.;Finished Airing;Nov 25, 2006;1;Movie;Novel;['Avant Garde', 'Award Winning', 'Fantasy', 'Horror', 'Mystery', 'Sci-Fi', 'Suspense'];['Adult Cast', 'Psychological'];NOT_EXIST;['Sony Pictures Entertainment', 'Cyclone Graphics'];Madhouse;None found, add some;['Hayashibara, Megumi', 'Hayashibara, Megumi', 'Ootsuka, Akio', 'Furuya, Toru', 'Kon, Satoshi', 'Hori, Katsunosuke', 'Tsutsui, Yasutaka', 'Tanaka, Hideyuki', 'Sakaguchi, Daisuke', 'Yamadera, Kouichi'];[{'name': 'Kon, Satoshi', 'role': 'Director, Script'}, {'name': 'Mima, Masafumi', 'role': 'Sound Director'}, {'name': 'Katou, Michiya', 'role': 'Episode Director, Director of Photography'}, {'name': 'Minakami, Seishi', 'role': 'Script, Screenplay'}];8.04;#532;R+ - Mild Nudity;4,238;#400;499,337;['Netflix'];"The world of dreams can be an incredible window into the psyche, showing one's deepest desires, aspirations, and repressed memories. One hopeful tech lab has been developing the ""DC Mini,"" a device with the power to delve into the dreams of others. Atsuko Chiba and Kosaku Tokita have been tirelessly working to develop this technology with the hopes of using it to deeply explore patients' minds and help cure them of their psychological disorders.  However, having access to the deepest corners of a person's mind comes with a tremendous responsibility. In the wrong hands, the DC Mini could be used as a form of psychological terrorism and cause mental breakdowns in the minds of targets. When this technology is stolen and people around them start acting strangely, Atsuko and Kosaku know they have a serious problem on their hands. Enlisting the help of Officer Konakawa, who has been receiving this experimental therapy, they search both the real and dream worlds for their mental terrorist.  [Written by MAL Rewrite]";NOT_EXIST;パプリカ
7;Mousou Dairinin;https://myanimelist.net/anime/323/Mousou_Dairinin;https://cdn.myanimelist.net/resources/mxj_panel/2023/20230313192021_20230315_ec-kimetsu-world-tour.jpg;24 min. per ep.;Finished Airing;Feb 3, 2004 to May 18, 2004;13;TV;Original;['Avant Garde', 'Drama', 'Mystery', 'Supernatural', 'Suspense'];['Detective', 'Psychological'];NOT_EXIST;['WOWOW', 'Asmik Ace', 'Tohokushinsha Film Corporation'];Madhouse;Funimation, Geneon Entertainment USA;['Sakaguchi, Daisuke', 'Noto, Mamiko', 'Seki, Toshihiko', 'Iizuka, Shouzou', 'Momoi, Haruko', 'Mitsuishi, Kotono', 'Saikachi, Ryuuji', 'Komiya, Kazue', 'Yamaguchi, Mayumi', 'Tominaga, Miina'];[{'name': 'Tanaka, Shinsaku', 'role': 'Assistant Producer'}, {'name': 'Kon, Satoshi', 'role': 'Director, Storyboard, Original Creator'}, {'name': 'Mima, Masafumi', 'role': 'Sound Director'}, {'name': 'Hamasaki, Hiroshi', 'role': 'Episode Director, Storyboard, Key Animation, Animation Director'}];7.67;#1226;R+ - Mild Nudity;5,193;#532;390,276;['Crunchyroll', 'Funimation', ''];The infamous Shounen Bat (Lil' Slugger) is terrorizing the residents of Musashino City. Flying around on his rollerblades and beating people down with a golden baseball bat, the assailant seems impossible to catch—much less understand. His first victim, the well-known yet timid character designer Tsukiko Sagi, is suspected of orchestrating the attacks. Believed only by her anthropomorphic pink stuffed animal, Maromi, Tsukiko is just one of Shounen Bat's many victims.  As Shounen Bat continues his relentless assault on the town, detectives Keiichi Ikari and Mitsuhiro Maniwa begin to investigate the identity of the attacker. However, more and more people fall victim to the notorious golden bat, and news of the assailant begins circulating around the town. Paranoia starts to set in as chilling rumors spread amongst adults and children alike.  Will the two detectives be able to unravel the truth behind Shounen Bat, or will the paranoia get to them first?  [Written by MAL Rewrite];Mousou Dairinin;妄想代理人
8;Mawaru Penguindrum;https://myanimelist.net/anime/10721/Mawaru_Penguindrum;https://cdn.myanimelist.net/resources/mxj_panel/2023/20230322230404_20230329_readmanga_1.png;24 min. per ep.;Finished Airing;Jul 8, 2011 to Dec 23, 2011;24;TV;Original;['Avant Garde', 'Comedy', 'Drama', 'Mystery'];NOT_EXIST;NOT_EXIST;['Starchild Records', 'Mainichi Broadcasting System'];Brain's Base;Sentai Filmworks;['Arakawa, Miho', 'Miyake, Marie', 'Kimura, Ryouhei', 'Kimura, Subaru', 'Koizumi, Yutaka', 'Kimura, Ryouhei', 'Kimura, Subaru', 'Arakawa, Miho', 'Horie, Yui', 'Toyosaki, Aki'];[{'name': 'Maruyama, Hiroo', 'role': 'Producer'}, {'name': 'Ikuhara, Kunihiko', 'role': 'Director, Episode Director, Script, Storyboard, Screenplay, Series Composition'}, {'name': 'Nakamura, Shouko', 'role': 'Director, Episode Director, Storyboard, Key Animation, Setting, Animation Director'}, {'name': 'Yamada, Haru', 'role': 'Sound Director'}];7.95;#650;R - 17+ (violence & profanity);7,162;#753;289,849;['HIDIVE'];"For the Takakura family, destiny is an ever-spinning wheel, pointing passionately in their direction with equal tides of joy and sorrow before ticking on to the next wishmaker. With their parents gone, twin brothers Kanba and Shouma live alone with their beloved little sister Himari, whose poor health cannot decline any further.  On the day Himari is given permission to temporarily leave the hospital, her brothers take her out to the aquarium to celebrate, where the family's supposed fate is brought forth with her sudden collapse. However, when Himari is inexplicably revived by a penguin hat from the aquarium's souvenir shop, the hand of fate continues to tick faithfully forward.  With her miraculous recovery, though, comes a cost: there is a new entity within her body, whose condition for keeping her fate at bay sends the boys on a wild goose chase for the mysterious ""Penguin Drum."" In their search, the boys will have to follow the threads of fate leading from their own shocking past and into the lives of other wishmakers vying for the Penguin Drum, all hoping to land upon their chosen destiny.  [Written by MAL Rewrite]";NOT_EXIST;輪るピングドラム
9;Boogiepop wa Warawanai (2019);https://myanimelist.net/anime/37451/Boogiepop_wa_Warawanai_2019;https://cdn.myanimelist.net/resources/mxj_panel/2023/20230322230404_20230329_readmanga_1.png;23 min. per ep.;Finished Airing;Jan 4, 2019 to Mar 29, 2019;18;TV;Light novel;['Avant Garde', 'Drama', 'Horror', 'Mystery', 'Supernatural'];NOT_EXIST;NOT_EXIST;['AT-X', 'Kadokawa Media House', 'Kadokawa'];Madhouse;Funimation;['Yuuki, Aoi', 'Oonishi, Saori', 'Yuuki, Aoi', 'Shimoji, Shino', 'Ichinose, Kana', 'Miyauchi, Atsushi', 'Kondou, Reina', 'Hanazawa, Kana', 'Enoki, Junya', 'Hosoya, Yoshimasa'];[{'name': 'Fukushi, Yuichiro', 'role': 'Producer'}, {'name': 'Iizuka, Aya', 'role': 'Producer'}, {'name': 'Ogata, Mitsuhiro', 'role': 'Producer'}, {'name': 'Tanaka, Shou', 'role': 'Producer'}];7.07;#3766;R - 17+ (violence & profanity);793;#1002;219,206;['Crunchyroll', 'Funimation'];"Hushed exchanges among the female student populace of Shinyo Academy center around an enigmatic supernatural entity. This entity is Boogiepop, a Shinigami who is rumored to murder people at the height of their beauty before their allure wanes. Few know of his true nature: a guardian who, between periods of dormancy, manifests as the alter ego of a high school girl named Touka Miyashita to fend off ""the enemies of the world."" Now, a string of mysterious disappearances—presumed by the school to be merely runaways—has caused Boogiepop to awaken. But somewhere in the academy, a menacing creature hides, waiting for its opportune moment to strike.  Boogiepop wa Warawanai subtly explores the intrinsic associations between human beings and their perception of time, while delving into its characters' complex relationships, emotions, memories, and pasts.  [Written by MAL Rewrite]";Boogiepop Never Laughs, Boogiepop Doesn't Laugh;ブギーポップは笑わない
10;Tenshi no Tamago;https://myanimelist.net/anime/885/Tenshi_no_Tamago;https://cdn.myanimelist.net/resources/mxj_panel/2023/20230322230404_20230329_readmanga_1.png;1 hr. 11 min.;Finished Airing;Dec 22, 1985;1;OVA;Original;['Avant Garde', 'Drama', 'Fantasy'];NOT_EXIST;NOT_EXIST;['Tokuma Shoten'];Studio Deen;Anchor Bay Films;['Hyoudou, Mako', 'Nezu, Jinpachi'];[{'name': 'Suzuki, Toshio', 'role': 'Producer'}, {'name': 'Oshii, Mamoru', 'role': 'Director, Screenplay, Original Creator'}, {'name': 'Shiba, Shigeharu', 'role': 'Sound Director'}, {'name': 'Anno, Hideaki', 'role': 'Layout'}];7.71;#1146;PG-13 - Teens 13 or older;3,057;#1503;136,418;[];The surrealist world of Tenshi no Tamago is desolate and devoid of the bustle of traditional everyday life. Instead, the world is filled with ominous phenomena, including floating orbs populated with statues of goddesses, gargantuan army tanks that seem to move unmanned, armies of fishermen who chase after the shadows of nonexistent fish, and caverns solely decorated with glass vessels of water.  In this run-down world, a young girl takes care of a large egg and scavenges for food and drink. She encounters a mysterious man with a cross over his shoulder, who soon becomes curious about who she is and what her egg contains. They decide to explore the lost and broken landscape together, questioning each other about the nature of faith, the purpose of the world, and the origins of their lives.  [Written by MAL Rewrite];NOT_EXIST;天使のたまご
11;FLCL Progressive;https://myanimelist.net/anime/33010/FLCL_Progressive;https://cdn.myanimelist.net/resources/mxj_panel/2023/20230322230404_20230329_readmanga_1.png;2 hr. 16 min.;Finished Airing;Sep 28, 2018;1;Movie;Original;['Action', 'Avant Garde', 'Comedy', 'Sci-Fi'];['Mecha', 'Parody'];NOT_EXIST;['Toho Visual Entertainment'];Production I.G, Signal.MD, Production GoodBook;NYAV Post;['Hayashibara, Megumi', 'Minase, Inori', 'Sawashiro, Miyuki', 'Fukuyama, Jun', 'Kurosawa, Tomoyo', 'Nakazawa, Masatomo', 'Shimizu, Ayaka', 'Suzuki, Reiko', 'Sugiyama, Riho'];[{'name': 'Ibata, Yoshihide', 'role': 'Co-Director'}, {'name': 'Terashima-Furuta, Maki', 'role': 'Producer'}, {'name': 'Kawahara, Junichirou', 'role': 'Producer, Production Assistant, Production Coordination'}, {'name': 'Honda, Fuminori', 'role': 'Producer'}];6.36;#7517;PG-13 - Teens 13 or older;236;#1587;127,049;['Crunchyroll'];Hidomi Hibajiri is a dissilusioned young girl who never takes off her headphones. Her whole life consists of going to school, helping out at her mother's cafe, and listening to music. And with nothing else to break the crippling monotony, she keeps her headphones on at all times. That is, until she is run over by a mysterious guitar-wielding woman.  That same night, a robot barges into Hidomi’s room along with a boy from her class, Ko Ide, and the kids are chased around town together. They're saved by the guitar-wielding woman from before, but now Hidomi's got a horn growing from her forehead? Who knows where these robots are coming from, what kind of vespa woman this weird guitar woman is warning her about, or what this thing on her forehead is, but it doesn't look like Hidomi is going to be able to ignore all this with headphones!  [Written by MAL Rewrite];FLCL 2, Fooly Cooly Progressive, Furi Kuri Progressive;フリクリ プログレ
12;Boogiepop wa Warawanai;https://myanimelist.net/anime/369/Boogiepop_wa_Warawanai;https://cdn.myanimelist.net/resources/mxj_panel/2022/20221116_paralive_club_event.png;24 min. per ep.;Finished Airing;Jan 5, 2000 to Mar 22, 2000;12;TV;Light novel;['Avant Garde', 'Drama', 'Horror', 'Mystery', 'Supernatural'];NOT_EXIST;NOT_EXIST;['VAP', 'Triangle Staff', 'd-rights'];Madhouse;Nozomi Entertainment;['Shimizu, Kaori', 'Asakawa, Yuu', 'Shimizu, Kaori', 'Asano, Mayumi', 'Nagasawa, Kyou', 'Tochihara, Rakuto', 'Chikada, Wasei', 'Kobayashi, Sanae', 'Fukuyama, Jun'];[{'name': 'Maruyama, Masao', 'role': 'Producer'}, {'name': 'Watanabe, Takashi', 'role': 'Director, Storyboard'}, {'name': 'Tsuruoka, Youta', 'role': 'Sound Director'}, {'name': 'Kasamatsu, Kouji', 'role': 'Sound Director'}];7.15;#3384;R+ - Mild Nudity;1,009;#1594;126,548;['Crunchyroll', 'Funimation'];Five years ago, a string of grisly murders shook the city to its core and now the rumors have begun once more. Boogiepop... Everyone knows about Boogiepop: meet her one dark night and you are taken. People tell each other the stories and laugh: no one believes that she can possibly exist in this day and age. Still, strange things appear to be going on and the darkness is taking on many forms. Something is out there. Are you safe?  (Source: RightStuf);Boogiepop Never Laughs, Boogiepop Doesn't Laugh;ブギーポップは笑わない Boogiepop Phantom
