;title;link;image_link;synonyms;japanese;type;episodes;status;aired;premiered;broadcast;producers;licensors;studios;source;genres;themes;duration;rating;score;ranked;popularity;members;favorites;demographic;platforms;synopsis;theme
16;Kiddy Grade;https://myanimelist.net/anime/274/Kiddy_Grade;https://cdn.myanimelist.net/resources/mxj_panel/2023/20230201162310_20230214_readthismanga-2023-2.png;;キディ・グレイド;TV;24;Finished Airing;Oct 9, 2002 to Mar 19, 2003;Fall 2002;Unknown;['gimik'];Funimation;Gonzo;Original;['Action', 'Sci-Fi', 'Ecchi'];;;23 min. per ep.;R+ - Mild Nudity;7.19;#3154;#3015;44,637;248;['Mecha', 'Super Power'];['Crunchyroll', 'Funimation'];In the distant future, humanity has taken to the skies and colonized many planets throughout the universe. An agency known as the Galactic Organization of Trade and Tariffs (GOTT) has been formed to maintain order. Within GOTT, a secret squad of enhanced human beings—known as the ES Unit—carry out secret missions to put a stop to major galactic crimes. Two such operatives are the lowly C-ranked Éclair and Lumière.  Despite being on the bottom of the totem pole, the pair wield formidable powers: Éclair's superhuman strength and lipstick whip and Lumière's ability to take control of any computer. Together, they can take on any mission that GOTT throws at them. But as they complete more and more missions, the duo begin to uncover a major conspiracy that leaves them questioning everything they know about themselves and the entire galaxy.  [Written by MAL Rewrite];
17;Freezing Specials;https://myanimelist.net/anime/10172/Freezing_Specials;https://cdn.myanimelist.net/resources/mxj_panel/2023/20230201162310_20230214_readthismanga-2023-2.png;Hajikechau! Dokidoki Trouble Freezing;はじけちゃう! ドキドキトラブルフリージング;Special;6;Finished Airing;Mar 30, 2011 to Aug 24, 2011;;;['Media Factory'];Funimation;A.C.G.T.;Unknown;['Action', 'Comedy', 'Ecchi'];;;3 min. per ep.;R+ - Mild Nudity;6.57;#6228;#3016;44,631;27;;[];These episodes focus on ecchi and comedy and don't have anything to do with the main story of Freezing.;
18;Ayakashi Triangle;https://myanimelist.net/anime/50606/Ayakashi_Triangle;https://cdn.myanimelist.net/resources/mxj_panel/2023/20230201162310_20230214_readthismanga-2023-2.png;;あやかしトライアングル;TV;12;Currently Airing;Jan 10, 2023 to ?;Winter 2023;Tuesdays at 01:00 (JST);['Aniplex', 'Yomiuri Telecasting', 'Chugai Mining', 'Shueisha', 'BS11', 'Marui Group'];None found, add some;Connect;Manga;['Action', 'Comedy', 'Romance', 'Supernatural', 'Ecchi'];;Shounen;23 min. per ep.;R+ - Mild Nudity;6.55;#6307;#3021;44,504;182;['Magical Sex Shift', 'Mythology'];['Crunchyroll', 'Aniplus TV', ''];"Ayakashi are strange, supernatural creatures invisible to the majority of people. Though most are harmless, some ayakashi attack humans to devour their life force. Exorcist ninjas are tasked with protecting people from these spiteful spirits.  Matsuri Kazamaki is a young exorcist ninja born to a prestigious clan. His childhood friend, Suzu Kanade, is an ayakashi medium—an individual with immense vitality that attracts ayakashi. Matsuri deems all ayakashi threatening and wishes to keep Suzu as far from them as possible, but this clashes with her desire to remain close to them. One day, the pair encounters Shirogane, the ""King of Ayakashi,"" who is hellbent on consuming Suzu. As she is about to be eaten, Matsuri comes to the rescue and manages to seal the ayakashi's powers—but not before Shirogane takes revenge by turning him into a girl!  Until he finds a way to transform back, Matsuri must adjust to his new, peculiar lifestyle while fighting against hostile ayakashi. Moreover, Suzu is now conflicted about her feelings toward Matsuri—further plunging their relationship into a state of ambiguity.  [Written by MAL Rewrite]";
19;Koukaku no Pandora;https://myanimelist.net/anime/32214/Koukaku_no_Pandora;https://cdn.myanimelist.net/resources/mxj_panel/2023/20230201162310_20230214_readthismanga-2023-2.png;;紅殻のパンドラ;TV;12;Finished Airing;Jan 8, 2016 to Mar 25, 2016;Winter 2016;Fridays at 23:00 (JST);['Lantis', 'Rakuonsha', 'AT-X', 'KlockWorx'];Funimation;Studio Gokumi, AXsiZ;Manga;['Action', 'Comedy', 'Sci-Fi', 'Ecchi'];;;24 min. per ep.;PG-13 - Teens 13 or older;6.50;#6658;#3025;44,427;87;;['Crunchyroll', 'Funimation'];Onboard a cruise ship heading to the scenic Cenancle Island, the full-body cyborg Nene Nanakorobi, a bubbly young girl who dreams of world peace, meets inventor Uzal Delilah. The two become fast friends along with Uzal's pet cyborg Clarion, a cat-like combat android. Soon after parting ways, a terrorist attack on the island threatens to shatter the pair's new friendship. In a bid to save her new friend, Uzal gives Nene the ability to use the Pandora Device found in Clarion's body before seemingly dying. With this power, Nene can temporarily master abilities and skills never seen before in the advancing world.  Working together, the two unlikely companions go on various missions—from saving children in shopping mall fires to fighting reckless thieves—all in the name of world peace. But to achieve this goal is not easy. B.U.E.R, a sentient laser in the form of a misshapen teddy bear, threatens to wreck their happy lives with his perverted nature and uncontrollable power. And to make matters worse, Nene's guardian, as well as genius inventor, Takumi Korobase has an undying interest in B.U.E.R.  Burdened with saving the world and keeping B.U.E.R from the hands of evil, Nene and Clarion's desire for world peace seems like a pipe dream. With this monumental goal, could the weight of it all destroy the pair's friendship completely?  [Written by MAL Rewrite];
20;HenSemi (TV);https://myanimelist.net/anime/10187/HenSemi_TV;https://cdn.myanimelist.net/resources/mxj_panel/2023/20230201162310_20230214_readthismanga-2023-2.png;Hentai Seiri Seminar, Hen Zemi, Abnormal Physiology Seminar;変ゼミ;TV;13;Finished Airing;Apr 8, 2011 to Jul 1, 2011;Spring 2011;Unknown;['None found', 'add some'];None found, add some;Xebec;Manga;['Comedy', 'Ecchi'];;Seinen;12 min. per ep.;R - 17+ (violence & profanity);6.51;#6619;#3038;44,118;69;;[];Matsutaka Nanako is a normal university student, who happened to enroll in an Abnormal Physiology seminar. She tries to keep her mental state sound, but other abnormal classmates start to influence her personality...  (Source: MU);
21;Shinmai Maou no Testament Specials;https://myanimelist.net/anime/30464/Shinmai_Maou_no_Testament_Specials;https://cdn.myanimelist.net/resources/mxj_panel/2023/20230201162310_20230214_readthismanga-2023-2.png;The Testament of Sister New Devil Specials;新妹魔王の契約者〈テスタメント〉;Special;6;Finished Airing;Mar 27, 2015 to Aug 28, 2015;;;['None found', 'add some'];Funimation;Production IMS;Light novel;['Comedy', 'Fantasy', 'Ecchi'];Mythology;;3 min. per ep.;R+ - Mild Nudity;6.74;#5313;#3039;44,098;39;;[];Specials included on the Blu-ray/DVD volumes. Chibi versions of Mio and Maria narrate Basara's various erotic encounters.;
22;Okusama ga Seitokaichou! Seitokaichou to Ofuro Asobi;https://myanimelist.net/anime/31980/Okusama_ga_Seitokaichou_Seitokaichou_to_Ofuro_Asobi;https://cdn.myanimelist.net/resources/mxj_panel/2023/20230201162310_20230214_readthismanga-2023-2.png;Okusama ga Seitokaichou! OVA;おくさまが生徒会長！ 生徒会長とお風呂遊び;OVA;1;Finished Airing;Jan 27, 2016;;;['None found', 'add some'];None found, add some;Seven;Manga;['Comedy', 'Romance', 'Ecchi'];;Shounen;10 min.;R+ - Mild Nudity;6.73;#5372;#3041;44,063;19;;[];Bundled with the limited edition ninth manga volume.;
23;Kanokon: Manatsu no Dai Shanikusai;https://myanimelist.net/anime/6791/Kanokon__Manatsu_no_Dai_Shanikusai;https://cdn.myanimelist.net/resources/mxj_panel/2023/20230201162310_20230214_readthismanga-2023-2.png;Kanokon R, Kanokon OVA;かのこん ～真夏の大謝肉祭～;OVA;2;Finished Airing;Oct 5, 2009 to Oct 12, 2009;;;['None found', 'add some'];Media Blasters;Xebec;Light novel;['Romance', 'Ecchi'];;;25 min. per ep.;R+ - Mild Nudity;6.54;#6429;#3049;43,604;28;;[];With the arrival of summer and the school break, Chizuru, Kota, and the rest of their friends are lazily enjoying the warm weather. Chizuru flirts with Kota, Kota gets embarrassed, and Nozomu gets in the way. Tayura pines after Akane, Akane rebuffs Tayura, and a sexy good time ensues. The status quo isn't quite the same since the fox snared her prey, but the timeless boy-meets-girl tale lingers on.  (Source: Media Blasters);
24;Cyclops Shoujo Saipuu;https://myanimelist.net/anime/17397/Cyclops_Shoujo_Saipuu;https://cdn.myanimelist.net/resources/mxj_panel/2023/20230201162310_20230214_readthismanga-2023-2.png;Cyclops Shoujo Saipu, Cyclops Girl Cypu;サイクロプス少女さいぷ～;ONA;12;Finished Airing;Mar 12, 2013 to May 30, 2013;;;['None found', 'add some'];None found, add some;None found, add some;4-koma manga;['Comedy', 'Slice of Life', 'Ecchi'];School;;2 min. per ep.;PG-13 - Teens 13 or older;5.74;#10673;#3071;43,022;34;;[];"When Fuuka hit her second year of middle school, puberty kicked in. Now she's really tall and has huge boobs. Due to her hairstyle, her classmates call her ""Saipu"", after the cyclops. Her affection for her older brother was cute when she was a little girl and said she wanted to marry him. Now it just freaks him out, since she's decided she's adult enough to follow through on her childish promises.  (Source: MU)";
25;School Days: Magical Heart Kokoro-chan;https://myanimelist.net/anime/3328/School_Days__Magical_Heart_Kokoro-chan;https://cdn.myanimelist.net/resources/mxj_panel/2023/20230201162310_20230214_readthismanga-2023-2.png;;School Days ～マジカルハート☆こころちゃん～;OVA;1;Finished Airing;Mar 26, 2008;;;['Avex Entertainment', 'Marvelous', 'Lantis', 'Pony Canyon'];Discotek Media;TNK;Visual novel;['Comedy', 'Ecchi'];Parody;;24 min.;R+ - Mild Nudity;5.54;#11525;#3076;42,876;22;;[];Originally an April's Fool in 2007, this one episode OVA is a spin-off of the School Days game by 0verflow, and shows Kokoro Katsura, the little sister of one of the main characters, from her other side. A mahou shoujo out to save the world, or something like that.  (Source: AniDB);
26;Fate/kaleid liner Prisma☆Illya Specials;https://myanimelist.net/anime/19109/Fate_kaleid_liner_Prisma%E2%98%86Illya_Specials;https://cdn.myanimelist.net/resources/mxj_panel/2023/20230201162310_20230214_readthismanga-2023-2.png;;Fate/kaleid liner プリズマ☆イリヤ;Special;5;Finished Airing;Sep 27, 2013 to Jan 31, 2014;;;['None found', 'add some'];None found, add some;SILVER LINK.;Manga;['Comedy', 'Fantasy', 'Ecchi'];Mahou Shoujo;;5 min. per ep.;PG-13 - Teens 13 or older;6.73;#5349;#3079;42,768;15;;[];Specials bundled with each of all five Blu-ray/DVD volumes.;
27;Boku no Kanojo ga Majimesugiru Sho-bitch na Ken OVA;https://myanimelist.net/anime/36560/Boku_no_Kanojo_ga_Majimesugiru_Sho-bitch_na_Ken_OVA;https://cdn.myanimelist.net/resources/mxj_panel/2023/20230201162310_20230214_readthismanga-2023-2.png;My Girlfriend is a Faithful Virgin Bitch, Boku no Kanojo ga Majimesugiru Shojo Bitch na Ken, My Girlfriend is Shobitch OVA;僕の彼女がマジメ過ぎるしょびっちな件 OVA;OVA;1;Finished Airing;Mar 26, 2018;;;['None found', 'add some'];Sentai Filmworks;Diomedéa, Studio Blanc.;Web manga;['Comedy', 'Romance', 'Ecchi'];School;;23 min.;R+ - Mild Nudity;6.37;#7404;#3091;42,560;28;;[];Bundled with the limited edition sixth manga volume.;
28;Tsuujou Kougeki ga Zentai Kougeki de Ni-kai Kougeki no Okaasan wa Suki desu ka? Namiuchigiwa no Okaasan wa Suki desu ka?;https://myanimelist.net/anime/40102/Tsuujou_Kougeki_ga_Zentai_Kougeki_de_Ni-kai_Kougeki_no_Okaasan_wa_Suki_desu_ka_Namiuchigiwa_no_Okaasan_wa_Suki_desu_ka;https://cdn.myanimelist.net/resources/mxj_panel/2023/20230201162310_20230214_readthismanga-2023-2.png;Do You Like Your Mom? Her Normal Attack is Two Attacks at Full Power OVA, Okaasan online OVA, Tsuujou Kougeki ga Zentai Kougeki de Ni-kai Kougeki no Okaasan wa Suki Desu ka? episode 13;通常攻撃が全体攻撃で二回攻撃のお母さんは好きですか？波打ち際のお母さんは好きですか?;OVA;1;Finished Airing;Mar 25, 2020;;;['Aniplex', 'Toranoana', 'Tokyo MX', 'Q-Tec', 'BS11', 'Contents Seed', 'Kadokawa', 'KLab'];None found, add some;J.C.Staff;Light novel;['Comedy', 'Fantasy', 'Ecchi'];;;23 min.;PG-13 - Teens 13 or older;6.05;#9232;#3106;42,354;85;;[];Unaired 13th episode.  To thank the group for all their hard work in the past, Shirase invites the party to enjoy the sunny beach. While enjoying the wonderful weather and pristine waters, an accident causes Masato to lose all his memories, including those of Mamako!  (Source: Funimation);
29;Macademi Wasshoi!;https://myanimelist.net/anime/3654/Macademi_Wasshoi;https://cdn.myanimelist.net/resources/mxj_panel/2023/20230201162310_20230214_readthismanga-2023-2.png;The Magician's Academy, MA Project;まかでみWAっしょい！;TV;12;Finished Airing;Oct 6, 2008 to Dec 22, 2008;Fall 2008;Unknown;['Media Factory'];None found, add some;Zexcs;Light novel;['Comedy', 'Fantasy', 'Romance', 'Supernatural', 'Ecchi'];;;24 min. per ep.;R+ - Mild Nudity;6.92;#4425;#3112;42,230;107;['Gag Humor', 'School'];[];"Magician's Academy revolves around Takuto Hasegawa, who attends a magic academy that is not marked on any map. During a summoning spell exam, he accidentally creates a girl named Tanarotte, who happens to hold enough magical power to destroy his country, but fortunately Tanarotte professes undying loyalty (and love) to her ""creator.""  (Source: ANN)";
30;Gokukoku no Brynhildr: Kara Sawagi;https://myanimelist.net/anime/24695/Gokukoku_no_Brynhildr__Kara_Sawagi;https://cdn.myanimelist.net/resources/mxj_panel/2023/20230201162310_20230214_readthismanga-2023-2.png;Gokukoku no Brynhildr Special, Gokukoku no Brynhildr Episode 11.5;極黒のブリュンヒルデ 第11.5話 から騒ぎ;Special;1;Finished Airing;Sep 24, 2014;;;['VAP'];Sentai Filmworks;Arms;Manga;['Comedy', 'Sci-Fi', 'Ecchi'];Harem;Seinen;20 min.;R+ - Mild Nudity;6.59;#6090;#3122;42,001;24;;[];Unaired episode 11.5 included with the second Blu-ray/DVD volume.;
31;Holy Knight;https://myanimelist.net/anime/11005/Holy_Knight;https://cdn.myanimelist.net/resources/mxj_panel/2023/20230201162310_20230214_readthismanga-2023-2.png;;Holy Knight (ホーリーナイト);OVA;2;Finished Airing;Mar 21, 2012 to May 25, 2012;;;['Cammot'];Media Blasters;Lilix;Manga;['Fantasy', 'Supernatural', 'Ecchi'];;Seinen;28 min. per ep.;R+ - Mild Nudity;5.93;#9837;#3130;41,828;50;['School', 'Vampire'];['Crunchyroll'];The story centers around a timid orphan named Mizumura Shinta who goes to a missionary school in Tokyo. His seemingly normal life changes when a beautiful half-human Romanian girl named Lilith suddenly transfers into his school. Mizumura discovers that he is actually a vampire hunter and the successor of the Romuald lineage.  (Source: ANN);
32;Nazo no Kanojo X: Nazo no Natsu Matsuri;https://myanimelist.net/anime/13093/Nazo_no_Kanojo_X__Nazo_no_Natsu_Matsuri;https://cdn.myanimelist.net/resources/mxj_panel/2023/20230201162310_20230214_readthismanga-2023-2.png;;謎の彼女X 謎の夏祭り;OVA;1;Finished Airing;Aug 23, 2012;;;['None found', 'add some'];None found, add some;Hoods Entertainment;Manga;['Mystery', 'Romance', 'Ecchi'];;Seinen;26 min.;PG-13 - Teens 13 or older;7.28;#2678;#3133;41,768;81;;[];OVA released with the 9th volume of the manga.  The day when Tsubaki goes to the summer festival with Ueno, Oka, and Urabe.;
33;Ane Log: Moyako Neesan no Tomaranai Monologue;https://myanimelist.net/anime/24531/Ane_Log__Moyako_Neesan_no_Tomaranai_Monologue;https://cdn.myanimelist.net/resources/mxj_panel/2023/20230201162310_20230214_readthismanga-2023-2.png;Sister's Log: Moyako's Never-ending Monologue;姉ログ 靄子姉さんの止まらないモノローグ;OVA;3;Finished Airing;Sep 16, 2014 to Apr 15, 2015;;;['Shogakukan-Shueisha Productions'];Sentai Filmworks;Brain's Base;Manga;['Comedy', 'Ecchi'];School;Shounen;23 min. per ep.;PG-13 - Teens 13 or older;6.03;#9327;#3143;41,517;51;;[];"When Konoe Moyako and her little brother, Akira, were young, he said he wanted to marry her. Naturally, Moyako decided that her little brother was a complete pervert who was obsessed with her. Now that they're both teenagers, Moyako is convinced she needs to ""rehabilitate"" him. However, it seems that the ""perversion"" is entirely in her imagination, and she can't seem to help turning completely innocent situations into creepy ones in her mind!  (Source: MU)  Bundled with the limited edition 5th, 6th, and 7th manga volumes.";
34;Fate/kaleid liner Prisma☆Illya 2wei! Specials;https://myanimelist.net/anime/25011/Fate_kaleid_liner_Prisma%E2%98%86Illya_2wei_Specials;https://cdn.myanimelist.net/resources/mxj_panel/2023/20230201162310_20230214_readthismanga-2023-2.png;Prisma Illya 2wei!: First Bra - Illya-hen, Prisma☆Illya 2nd Season: First Bra - Illya-hen, Fate/kaleid liner Prisma☆Illya 2wei!: First Bra - Illya-hen;Fate/kaleid liner プリズマ☆イリヤ ツヴァイ!;Special;5;Finished Airing;Sep 26, 2014 to Jan 30, 2015;;;['Lantis', 'DAX Production'];Sentai Filmworks;SILVER LINK.;Manga;['Comedy', 'Fantasy', 'Ecchi'];Mahou Shoujo;;5 min. per ep.;PG-13 - Teens 13 or older;6.82;#4894;#3144;41,500;19;;[];Short specials included with the Blu-ray/DVD releases of the TV series.;
35;Nora to Oujo to Noraneko Heart;https://myanimelist.net/anime/32447/Nora_to_Oujo_to_Noraneko_Heart;https://cdn.myanimelist.net/resources/mxj_panel/2023/20230201162310_20230214_readthismanga-2023-2.png;Noratoto;ノラと皇女と野良猫ハート;TV;11;Finished Airing;Jul 12, 2017 to Sep 27, 2017;Summer 2017;Wednesdays at 22:45 (JST);['Magic Capsule'];None found, add some;W-Toon Studio, DMM.futureworks;Visual novel;['Comedy', 'Ecchi'];;;3 min. per ep.;PG-13 - Teens 13 or older;5.38;#12095;#3154;41,203;33;;['Crunchyroll'];Nora Handa is a boy who lives with Shachi Yuuri, who was adopted by his mother. With everyone supporting, the two of them grew up healthily even after their parents passed away. Shachi, who likes Nora the most, wakes him up every morning.  Nora spends his happy student life with Michi Kuroki, who is a disciplinary committee, honor student at school and childhood friend of the main character, Yuuki Asuhara, who is a gal but is very bright and can talk his worries to, and more friends at school.  One day, Nora meets a girl who calls herself Patricia at the park on the way to the school. Patricia is a queen at hell, and claims to come here to destroy the life on land. However, she is damaged heavily because she touched the life for the first time. The energy was stronger than her, so Nora needed to tend her. Patricia asked him to tell her about the mysteries of life, and he had to even explain the ero book that he found at the park...?!  (Source: Amazon Japan);
36;Senran Kagura Shinovi Master: Tokyo Youma-hen;https://myanimelist.net/anime/36037/Senran_Kagura_Shinovi_Master__Tokyo_Youma-hen;https://cdn.myanimelist.net/resources/mxj_panel/2023/20230201162310_20230214_readthismanga-2023-2.png;Senran Kagura 2nd Season;閃乱カグラ SHINOVI MASTER -東京妖魔篇-;TV;12;Finished Airing;Oct 13, 2018 to Dec 29, 2018;Fall 2018;Saturdays at 00:00 (JST);['Sotsu', 'Lantis', 'AT-X', 'Crunchyroll SC Anime Fund'];Funimation;TNK;Game;['Action', 'Comedy', 'Ecchi'];School;;23 min. per ep.;R+ - Mild Nudity;6.31;#7788;#3156;41,192;92;;[];"Girls study at schools for modern shinobi. They dedicate their entire young lives to learning to become true shinobi, battling each other to polish their skills. And then one day, Asuka, whose grandfather is a legendary shinobi, encounters an ancient evil being named a ""Youma"" in the back alleys of Tokyo at Christmastime. Where there is light, there is shadow. Over 28 of the strongest and most well-endowed ninjas in history, both good and evil, will collide in a battle to determine true justice. And this deadly battle begins... right now.  (Source: Crunchyroll)";
37;Military!;https://myanimelist.net/anime/26085/Military;https://cdn.myanimelist.net/resources/mxj_panel/2023/20230201162310_20230214_readthismanga-2023-2.png;Miritari!;みりたり!;TV;12;Finished Airing;Jan 7, 2015 to Mar 25, 2015;Winter 2015;Wednesdays at 23:25 (JST);['DAX Production', 'Dream Creation'];None found, add some;Creators in Pack;4-koma manga;['Comedy', 'Slice of Life', 'Ecchi'];Military;;3 min. per ep.;PG-13 - Teens 13 or older;5.78;#10501;#3159;41,043;48;;['Crunchyroll'];The story takes place during a conflict between the Krakozhia Dukedom and the Grania Republic. In the midst of the fighting, a savior appears to the Krakozhia Dukedom, and it is a high school student named Yano Souhei. Two female soldiers, First Lieutenant Ruto and Second Lieutenant Haruka, appear in tanks to intrude on Souhei's everyday life, followed by the enemy soldier Shachirofu, all of whom use firearms without hesitation at his house.  (Source: ANN);
38;Queen's Blade: Rebellion;https://myanimelist.net/anime/11859/Queens_Blade__Rebellion;https://cdn.myanimelist.net/resources/mxj_panel/2023/20230201162310_20230214_readthismanga-2023-2.png;;クイーンズブレイド リベリオン;TV;12;Finished Airing;Apr 3, 2012 to Jun 19, 2012;Spring 2012;Unknown;['Genco', 'Media Factory', 'AT-X', 'Hobby Japan'];Sentai Filmworks, NYAV Post;Arms;Other;['Action', 'Adventure', 'Fantasy', 'Ecchi'];;;24 min. per ep.;R+ - Mild Nudity;6.26;#8073;#3164;40,982;60;;['HIDIVE'];Power corrupts, and it when it appears that the once noble Queen Claudette's ways have turned to oppression and heretical persecution, it's up to a new generation of warriors to step up to the plate armor to bear arms and bare their naked fury in open rebellion! The odds may seem unfairly stacked in favor of the Amazonian ranks of the queen, doubly supported by her power of writ and assassins. But the incredible wits and assets of the dazzling array of daring damsels willing to risk their gorgeous skins and put their lithesome bodies on line against her, might just expose a few unexpected weaknesses in the queen's support!  (Source: Sentai Filmworks);
39;Getsuyoubi no Tawawa Specials;https://myanimelist.net/anime/34481/Getsuyoubi_no_Tawawa_Specials;https://cdn.myanimelist.net/resources/mxj_panel/2023/20230201162310_20230214_readthismanga-2023-2.png;;月曜日のたわわ 特典;Special;2;Finished Airing;Dec 29, 2016;;;['NBCUniversal Entertainment Japan', 'i0+'];None found, add some;PINE JAM;Other;['Slice of Life', 'Ecchi'];;;5 min. per ep.;PG-13 - Teens 13 or older;6.58;#6150;#3167;40,949;36;;[];Two special episodes of Getsuyoubi no Tawawa included on Blu-ray. 1. Ukkarimono daga Aisare Jouzu no Kawaii Kouhai 2. Ai-chan to Private Film;
40;Strike Witches Movie;https://myanimelist.net/anime/9751/Strike_Witches_Movie;https://cdn.myanimelist.net/resources/mxj_panel/2023/20230201162310_20230214_readthismanga-2023-2.png;Strike Witches Gekijouban;ストライクウィッチーズ 劇場版;Movie;1;Finished Airing;Mar 17, 2012;;;['Kadokawa Shoten', 'Nippon Columbia', 'KlockWorx', 'NTT Docomo', 'Sony PCL'];Funimation;AIC;Original;['Action', 'Sci-Fi', 'Ecchi'];Military;;1 hr. 37 min.;PG-13 - Teens 13 or older;7.58;#1457;#3176;40,736;120;;[];After fending off the threat of a Neuroi invasion of Romagna and destroying the enemy's nest over Venezia, Yoshika Miyafuji goes back to her home town in the Empire of Fusou. Despite the loss of her magical and healing abilities, the former officer of the 501st Joint Fighter Wing wants to continue studying medicine. This is in order to help those in need, both civilians and those on the front lines alike. She receives an invitation from a prestigious school in Europe and decides to accept the offer, embarking on a journey back to the war-torn continent.  However, a new danger arises, as more and more Neuroi manage to break through human defense lines, appearing unnoticed in supposedly safe areas and disturbing the balance of power in Europe. Yoshiki's sense of duty collides with her inability to pilot a Striker Unit, but with her friends in peril, it seems that there is only one thing she can do.  [Written by MAL Rewrite];
41;Kemeko Deluxe!;https://myanimelist.net/anime/3464/Kemeko_Deluxe;https://cdn.myanimelist.net/resources/mxj_panel/2023/20230201162310_20230214_readthismanga-2023-2.png;The Unknown Girlfriend, Kemeko DX;ケメコデラックス！;TV;12;Finished Airing;Oct 5, 2008 to Dec 21, 2008;Fall 2008;Unknown;['Geneon Universal Entertainment', 'Yomiuri Telecasting', 'KlockWorx', 'AC Create', 'Yomiuri Advertising', 'ASCII Media Works'];None found, add some;Hal Film Maker;Manga;['Action', 'Comedy', 'Romance', 'Sci-Fi', 'Ecchi'];School;Shounen;24 min. per ep.;PG-13 - Teens 13 or older;6.55;#6332;#3177;40,682;52;;[];When Sanpeita Kobayashi was a child, his lovely friend had to move away, but she vowed that in ten years, they would meet again—as husband and wife. Ten years later, Sanpeita is a high school student, but he hasn't forgotten the feelings they shared.  Sanpeita awakes from a dream about his last day with her, only to have his morning interrupted. A weird robot girl is battling other robots in his bedroom, claiming to be his wife. The robot's pilot looks like none other than Sanpeita's long-lost, childhood friend. But who is she really? Why did she have to leave? And what does she have to do with the Mishima Electronics Corporation?;
