;title;link;image_link;synonyms;japanese;type;episodes;status;aired;premiered;broadcast;producers;licensors;studios;source;genres;themes;duration;rating;score;ranked;popularity;members;favorites;demographic;platforms;synopsis;theme
0;No Game No Life;https://myanimelist.net/anime/19815/No_Game_No_Life;https://cdn.myanimelist.net/resources/mxj_panel/2023/20230201162310_20230214_readthismanga-2023-2.png;NGNL;ノーゲーム・ノーライフ;TV;12;Finished Airing;Apr 9, 2014 to Jun 25, 2014;Spring 2014;Wednesdays at 21:30 (JST);['Frontier Works', 'Media Factory', 'Movic', 'AT-X'];Sentai Filmworks;Madhouse;Light novel;['Comedy', 'Fantasy', 'Ecchi'];['Isekai', 'Strategy Game'];23 min. per ep.;PG-13 - Teens 13 or older;8.09;#473;#16;2,265,271;47,114;;['HIDIVE', 'Netflix'];"Sixteen sentient races inhabit Disboard, a world overseen by Tet, the One True God. The lowest of the sixteen—Imanity—consists of humans, a race with no affinity for magic. In a place where everything is decided through simple games, humankind seems to have no way out of their predicament—but the arrival of two outsiders poses a change.  On Earth, stepsiblings Sora and Shiro are two inseparable shut-ins who dominate various online games under the username ""Blank."" While notorious on the internet, the pair believe that life is merely another dull game. However, after responding to a message from an unknown user, they are suddenly transported to Disboard. The mysterious sender turns out to be Tet, who informs them about the world's absolute rules. After Tet leaves, Sora and Shiro begin their search for more information and a place to stay, taking them to Elkia—Imanity's only remaining kingdom.  There, the duo encounters Stephanie Dola, an emotional girl vying for the kingdom's sovereignty. In desperation, she attempts to regain her father's throne, but her foolhardiness makes her goal unachievable. Inspired by the girl's motivation and passion, Sora and Shiro decide to aid Stephanie in getting Elkia back on its feet, ultimately aiming to become the new rulers of the enigmatic realm.  [Written by MAL Rewrite]";
1;Kill la Kill;https://myanimelist.net/anime/18679/Kill_la_Kill;https://cdn.myanimelist.net/resources/mxj_panel/2023/20230201162310_20230214_readthismanga-2023-2.png;KLK, Dressed to Kill;キルラキル;TV;24;Finished Airing;Oct 4, 2013 to Mar 28, 2014;Fall 2013;Fridays at 02:05 (JST);['Aniplex', 'Dentsu', 'Kadokawa Shoten', 'Mainichi Broadcasting System', 'Movic', 'Ultra Super Pictures', 'Lucent Pictures Entertainment'];Aniplex of America;Trigger;Original;['Action', 'Comedy', 'Ecchi'];['School', 'Super Power'];24 min. per ep.;PG-13 - Teens 13 or older;8.04;#527;#51;1,630,189;36,414;;['Crunchyroll', 'Funimation', ''];"After the murder of her father, Ryuuko Matoi has been wandering the land in search of his killer. Following her only lead—the missing half of his invention, the Scissor Blade—she arrives at the prestigious Honnouji Academy, a high school unlike any other. The academy is ruled by the imposing and cold-hearted student council president Satsuki Kiryuuin alongside her powerful underlings, the Elite Four. In the school's brutally competitive hierarchy, Satsuki bestows upon those at the top special clothes called ""Goku Uniforms,"" which grant the wearer unique superhuman abilities.  Thoroughly beaten in a fight against one of the students in uniform, Ryuuko retreats to her razed home where she stumbles across Senketsu, a rare and sentient ""Kamui,"" or God Clothes. After coming into contact with Ryuuko's blood, Senketsu awakens, latching onto her and providing her with immense power. Now, armed with Senketsu and the Scissor Blade, Ryuuko makes a stand against the Elite Four, hoping to reach Satsuki and uncover the culprit behind her father's murder once and for all.  [Written by MAL Rewrite]";
2;Shokugeki no Souma;https://myanimelist.net/anime/28171/Shokugeki_no_Souma;https://cdn.myanimelist.net/resources/mxj_panel/2023/20230201162310_20230214_readthismanga-2023-2.png;Shokugeki no Soma, Food Wars: Shokugeki no Soma;食戟のソーマ;TV;24;Finished Airing;Apr 4, 2015 to Sep 26, 2015;Spring 2015;Saturdays at 02:25 (JST);['Dentsu', 'Frontier Works', 'Mainichi Broadcasting System', 'Magic Capsule', 'Warner Bros. Japan', 'KlockWorx', 'Showgate', 'Shueisha', 'I Will'];Sentai Filmworks;J.C.Staff;Manga;['Gourmet', 'Ecchi'];;25 min. per ep.;PG-13 - Teens 13 or older;8.16;#392;#57;1,557,897;23,351;Shounen;['HIDIVE', 'Netflix', ''];"Souma Yukihira has been cooking alongside his father Jouichirou for as long as he can remember. As a sous chef at his father's restaurant, he has spent years developing his culinary expertise and inventing new dishes to amaze their customers. He aspires to exceed his father's skill and take over the restaurant one day, but he is shocked to learn that Jouichirou is closing up the shop to take a job in New York.  Rather than tagging along with his father, Souma finds himself enrolling at the prestigious Tootsuki Culinary Academy, where only 10 percent of its students end up graduating. The school is famous for its ""Shokugeki""—intense cooking competitions between students often used to settle debates and arguments. Jouichirou tells Souma that to surpass him and survive the next three years at Tootsuki and graduate there.  The academy's brutal curriculum and fiercely competitive student body await the young chef, who must learn to navigate the treacherous environment if he wants to stand a chance at realizing his dreams. But is skill alone enough to let him rise to the top?  [Written by MAL Rewrite]";School
3;Highschool of the Dead;https://myanimelist.net/anime/8074/Highschool_of_the_Dead;https://cdn.myanimelist.net/resources/mxj_panel/2023/20230201162310_20230214_readthismanga-2023-2.png;Gakuen Mokushiroku: Highschool of the Dead, HOTD, HSOTD;学園黙示録 HIGHSCHOOL OF THE DEAD;TV;12;Finished Airing;Jul 5, 2010 to Sep 20, 2010;Summer 2010;Mondays at 11:30 (JST);['Geneon Universal Entertainment', 'AT-X', 'Showgate'];Sentai Filmworks;Madhouse;Manga;['Action', 'Horror', 'Supernatural', 'Ecchi'];['Gore', 'Survival'];24 min. per ep.;R+ - Mild Nudity;7.08;#3698;#72;1,425,824;9,746;Shounen;['HIDIVE', 'Netflix'];"It happened suddenly: The dead began to rise and Japan was thrown into total chaos. As these monsters begin terrorizing a high school, Takashi Kimuro is forced to kill his best friend when he gets bitten and joins the ranks of the walking dead. Vowing to protect Rei Miyamoto, the girlfriend of the man he just executed, they narrowly escape their death trap of a school, only to be greeted with a society that has already fallen.  Soon, Takashi and Rei band together with other students on a journey to find their family members and uncover what caused this overwhelming pandemic. Joining them is Saeko Busujima, the beautiful president of the Kendo Club; Kouta Hirano, an otaku with a fetish for firearms; Saya Takagi, the daughter of an influential politician; and Shizuka Marikawa, their hot school nurse. But will the combined strength of these individuals be enough to conquer this undead apocalypse?  [Written by MAL Rewrite]";
4;High School DxD;https://myanimelist.net/anime/11617/High_School_DxD;https://cdn.myanimelist.net/resources/mxj_panel/2023/20230201162310_20230214_readthismanga-2023-2.png;Highschool DxD;ハイスクールD×D;TV;12;Finished Airing;Jan 6, 2012 to Mar 23, 2012;Winter 2012;Fridays at 11:00 (JST);['Genco', 'Lantis', 'Media Factory', 'AT-X', 'PRA', 'Showgate', 'Atelier Musa', 'Fujimi Shobo'];Funimation;TNK;Light novel;['Comedy', 'Romance', 'Ecchi'];['Harem', 'Mythology', 'School'];24 min. per ep.;R+ - Mild Nudity;7.34;#2380;#80;1,345,515;21,655;;['Funimation', 'Netflix'];High school student Issei Hyoudou is your run-of-the-mill pervert who does nothing productive with his life, peeping on women and dreaming of having his own harem one day. Things seem to be looking up for Issei when a beautiful girl asks him out on a date, although she turns out to be a fallen angel who brutally kills him! However, he gets a second chance at life when beautiful senior student Rias Gremory, who is a top-class devil, revives him as her servant, recruiting Issei into the ranks of the school's Occult Research club.  Slowly adjusting to his new life, Issei must train and fight in order to survive in the violent world of angels and devils. Each new adventure leads to many hilarious (and risqué) moments with his new comrades, all the while keeping his new life a secret from his friends and family in High School DxD!  [Written by MAL Rewrite];
5;Mushoku Tensei: Isekai Ittara Honki Dasu;https://myanimelist.net/anime/39535/Mushoku_Tensei__Isekai_Ittara_Honki_Dasu;https://cdn.myanimelist.net/resources/mxj_panel/2023/20230201162310_20230214_readthismanga-2023-2.png;Jobless Reincarnation: I Will Seriously Try If I Go To Another World;無職転生 ～異世界行ったら本気だす～;TV;11;Finished Airing;Jan 11, 2021 to Mar 22, 2021;Winter 2021;Mondays at 00:00 (JST);['Frontier Works', 'TOHO animation', 'Hakuhodo DY Music & Pictures', 'BS11', 'Egg Firm', 'Kadokawa', 'GREE', 'Toho Music'];Funimation;Studio Bind;Light novel;['Drama', 'Fantasy', 'Ecchi'];['Isekai', 'Reincarnation'];23 min. per ep.;R - 17+ (violence & profanity);8.37;#196;#120;1,099,109;27,075;;['Crunchyroll', 'Funimation', '', '', '', ''];Despite being bullied, scorned, and oppressed all of his life, a 34-year-old shut-in still found the resolve to attempt something heroic—only for it to end in a tragic accident. But in a twist of fate, he awakens in another world as Rudeus Greyrat, starting life again as a baby born to two loving parents.  Preserving his memories and knowledge from his previous life, Rudeus quickly adapts to his new environment. With the mind of a grown adult, he starts to display magical talent that exceeds all expectations, honing his skill with the help of a mage named Roxy Migurdia. Rudeus learns swordplay from his father, Paul, and meets Sylphiette, a girl his age who quickly becomes his closest friend.  As Rudeus' second chance at life begins, he tries to make the most of his new opportunity while conquering his traumatic past. And perhaps, one day, he may find the one thing he could not find in his old world—love.  [Written by MAL Rewrite];
6;Shokugeki no Souma: Ni no Sara;https://myanimelist.net/anime/32282/Shokugeki_no_Souma__Ni_no_Sara;https://cdn.myanimelist.net/resources/mxj_panel/2023/20230201162310_20230214_readthismanga-2023-2.png;Shokugeki no Souma 2nd Season, Shokugeki no Soma 2, Food Wars: Shokugeki no Soma 2, Shokugeki no Soma: The Second Plate;食戟のソーマ 弍ノ皿;TV;13;Finished Airing;Jul 2, 2016 to Sep 24, 2016;Summer 2016;Saturdays at 22:00 (JST);['Dentsu', 'Lantis', 'Mainichi Broadcasting System', 'KlockWorx', 'Showgate', 'Shueisha'];Sentai Filmworks;J.C.Staff;Manga;['Gourmet', 'Ecchi'];;24 min. per ep.;PG-13 - Teens 13 or older;8.10;#453;#123;1,077,189;3,042;Shounen;['HIDIVE', 'Netflix', ''];The qualifiers of the Autumn Elections are now over, and only eight talented chefs remain. Now, they face off in one-on-one food wars, each with their own unique themes. Met with both new judges and new opponents all with their own specialties, Souma must stay on his toes if he hopes to make it to the top of both the Autumn Elections and Tootsuki Culinary Academy.  [Written by MAL Rewrite];School
7;Prison School;https://myanimelist.net/anime/30240/Prison_School;https://cdn.myanimelist.net/resources/mxj_panel/2023/20230201162310_20230214_readthismanga-2023-2.png;Kangoku Gakuen;監獄学園〈プリズンスクール〉;TV;12;Finished Airing;Jul 11, 2015 to Sep 26, 2015;Summer 2015;Saturdays at 01:05 (JST);['Genco', 'Kodansha', 'Movic', 'Warner Bros. Japan', 'KlockWorx', 'Showgate'];Funimation;J.C.Staff;Manga;['Comedy', 'Romance', 'Ecchi'];['Gag Humor', 'School'];24 min. per ep.;R+ - Mild Nudity;7.61;#1377;#150;948,178;6,991;Seinen;['Crunchyroll', 'Funimation', ''];Located on the outskirts of Tokyo, Hachimitsu Private Academy is a prestigious all-girls boarding school, famous for its high-quality education and disciplined students. However, this is all about to change due to the revision of the school's most iconic policy, as boys are now able to enroll as well.  At the start of the first semester under this new decree, a mere five boys have been accepted, effectively splitting the student body into a ratio of two hundred girls to one boy. Kiyoshi, Gakuto, Shingo, Andre, and Jo are quickly cast away without having a chance to make any kind of a first impression. Unable to communicate with their fellow female students, the eager boys set their sights on a far more dangerous task: peeping into the girls' bath!  It's only after their plan is thoroughly decimated by the infamous Underground Student Council that the motley crew find their freedom abruptly taken from them, as they are thrown into the school's prison with the sentence of an entire month as punishment. Thus begins the tale of the boys' harsh lives in Prison School, a righteous struggle that will ultimately test the bonds of friendship and perverted brotherhood.  [Written by MAL Rewrite];
8;Shokugeki no Souma: San no Sara;https://myanimelist.net/anime/35788/Shokugeki_no_Souma__San_no_Sara;https://cdn.myanimelist.net/resources/mxj_panel/2023/20230201162310_20230214_readthismanga-2023-2.png;Shokugeki no Soma 3rd Season, Shokugeki no Soma 3;食戟のソーマ 餐ノ皿;TV;12;Finished Airing;Oct 4, 2017 to Dec 20, 2017;Fall 2017;Wednesdays at 00:30 (JST);['Lantis', 'Warner Bros. Japan', 'KlockWorx', 'Shueisha'];Sentai Filmworks;J.C.Staff;Manga;['Gourmet', 'Ecchi'];;24 min. per ep.;PG-13 - Teens 13 or older;8.02;#556;#155;918,624;2,618;Shounen;['Crunchyroll', 'Netflix', ''];"The Moon Festival is Tootsuki Academy's annual gourmet gala, where students compete against each other to earn the most profit through selling their cuisine of choice. But for Souma Yukihira, it is also his first opportunity to challenge the Elite Ten, the supreme council that rules over the academy.  However, this is only the beginning of Souma's war against the Elite Ten; a nefarious plot is underway that will provide Souma with the challenge he desires but will also shake the very foundations of Tootsuki Academy itself.  [Written by MAL Rewrite]";School
9;Rakudai Kishi no Cavalry;https://myanimelist.net/anime/30296/Rakudai_Kishi_no_Cavalry;https://cdn.myanimelist.net/resources/mxj_panel/2023/20230201162310_20230214_readthismanga-2023-2.png;A Chivalry of the Failed Knight, Rakudai Kishi no Eiyuutan, A Tale of Worst One;落第騎士の英雄譚《キャバルリィ》;TV;12;Finished Airing;Oct 3, 2015 to Dec 19, 2015;Fall 2015;Saturdays at 23:00 (JST);['Frontier Works', 'Media Factory', 'AT-X', 'flying DOG', 'Hakuhodo DY Music & Pictures', 'Animatic', 'SB Creative'];Sentai Filmworks;SILVER LINK., Nexus;Light novel;['Action', 'Fantasy', 'Romance', 'Ecchi'];;23 min. per ep.;R - 17+ (violence & profanity);7.45;#1896;#164;889,787;8,397;;['Crunchyroll', 'HIDIVE', ''];"There exist few humans in this world with the ability to manipulate their souls to form powerful weapons. Dubbed ""Blazers,"" these people study and train at the prestigious Hagun Academy to become Mage-Knights; among the students is so-called failure Ikki Kurogane, the sole F-rated Blazer. However, when the worst student in the academy sees Stella Vermillion, an A-ranked Blazer who also happens to be a princess, naked, she challenges him to a duel with dire stakes—the loser becomes the slave of the winner. There's no possible way that Stella can lose, right?  As he tries to prove his strength to a world that believes him to be the weakest, Ikki gains new friends, wisdom, and experience.  [Written by MAL Rewrite]";School
10;High School DxD New;https://myanimelist.net/anime/15451/High_School_DxD_New;https://cdn.myanimelist.net/resources/mxj_panel/2023/20230201162310_20230214_readthismanga-2023-2.png;High School DxD Dai 2-ki, High School DxD 2nd Season, High School DxD Second Season, Highschool DxD 2;ハイスクールD×D NEW;TV;12;Finished Airing;Jul 7, 2013 to Sep 22, 2013;Summer 2013;Sundays at 20:30 (JST);['Genco', 'Lantis', 'Media Factory', 'Movic', 'AT-X', 'Showgate', 'Q-Tec', 'Fujimi Shobo'];Funimation;TNK;Light novel;['Action', 'Comedy', 'Romance', 'Ecchi'];['Harem', 'Mythology', 'School'];26 min. per ep.;R+ - Mild Nudity;7.48;#1806;#171;869,354;4,446;;['Netflix'];The misadventures of Issei Hyoudou, high school pervert and aspiring Harem King, continue on in High School DxD New. As the members of the Occult Research Club carry out their regular activities, it becomes increasingly obvious that there is something wrong with their Knight, the usually composed and alert Yuuto Kiba. Soon, Issei learns of Kiba's dark, bloody past and its connection to the mysterious Holy Swords. Once the subject of a cruel experiment, Kiba now seeks revenge on all those who wronged him.  With the return of an old enemy, as well as the appearance of two new, Holy Sword-wielding beauties, it isn't long before Issei and his Devil comrades are plunged into a twisted plot once more.  [Written by MAL Rewrite];
11;Trinity Seven;https://myanimelist.net/anime/25157/Trinity_Seven;https://cdn.myanimelist.net/resources/mxj_panel/2023/20230201162310_20230214_readthismanga-2023-2.png;;トリニティセブン;TV;12;Finished Airing;Oct 8, 2014 to Dec 24, 2014;Fall 2014;Wednesdays at 01:40 (JST);['TV Tokyo', 'Sotsu', 'Kadokawa Shoten', 'AT-X', 'Studio Mausu', 'Avex Pictures', 'Q-Tec', 'Docomo Anime Store', 'DeNA'];Sentai Filmworks;Seven Arcs Pictures;Manga;['Action', 'Comedy', 'Fantasy', 'Romance', 'Ecchi'];['Harem', 'School'];24 min. per ep.;PG-13 - Teens 13 or older;7.07;#3775;#201;796,912;3,720;Shounen;['Crunchyroll', 'HIDIVE'];"One day, the bright red sun stopped shining, causing the ""Breakdown Phenomenon""—the destruction of Arata Kasuga's town and the disappearance of the people inhabiting it. All, however, is not yet lost; by utilizing the magical grimoire given to him by his childhood friend and cousin Hijiri Kasuga, Arata's world gets artificially reconstructed.  In order to investigate the phenomenon, Lilith Asami appears before Arata, whose artificial world suddenly disintegrates. He is given two choices: hand over the book, or die. However, Arata chooses the third option—enrolling in the top-secret magic school Royal Biblia Academy, where six other magical users await him. Together with Lilith, these six form the Trinity Seven, the elite of the school who each bolster their own power and skill.  With the ambition to save Hijiri and the help of his newfound friends, Arata stops at nothing to prevent the destruction of his beloved hometown and to bring his best friend back.  [Written by MAL Rewrite]";
12;Zero no Tsukaima;https://myanimelist.net/anime/1195/Zero_no_Tsukaima;https://cdn.myanimelist.net/resources/mxj_panel/2023/20230201162310_20230214_readthismanga-2023-2.png;Zero's Familiar;ゼロの使い魔;TV;13;Finished Airing;Jul 3, 2006 to Sep 25, 2006;Summer 2006;Mondays at 00:30 (JST);['Genco', 'Media Factory', 'Shochiku', 'Bushiroad', 'Happinet Pictures'];Sentai Filmworks, Geneon Entertainment USA;J.C.Staff;Light novel;['Action', 'Adventure', 'Comedy', 'Fantasy', 'Romance', 'Ecchi'];['Harem', 'Isekai', 'School'];23 min. per ep.;PG-13 - Teens 13 or older;7.24;#2844;#205;783,467;7,795;;['Crunchyroll', 'Netflix'];"Louise Françoise Le Blanc de La Vallière is a self-absorbed mage in a world of wands, cloaks, and royalty. Although she studies at Tristain Academy, a prestigious school for magicians, she has a major problem: Louise is unable to cast magic properly, earning her the nickname of ""Louise the Zero"" from her classmates.  When the first year students are required to perform a summoning ritual, Louise's summoning results in a catastrophic explosion! Everyone deems this to be yet another failure, but when the smoke clears, a boy named Saito Hiraga appears. Now Louise's familiar, Saito is treated as a slave, forced to clean her clothes and eat off the ground. But when an unfamiliar brand is found etched on Saito's hand from the summoning ritual, it is believed to be the mark of a powerful familiar named Gandalfr.  Wild, adventurous, and explosive, Zero no Tsukaima follows Saito as he comes to terms with his new life and as Louise proves that there is more to her than her nickname suggests.  [Written by MAL Rewrite]";
13;Boku wa Tomodachi ga Sukunai;https://myanimelist.net/anime/10719/Boku_wa_Tomodachi_ga_Sukunai;https://cdn.myanimelist.net/resources/mxj_panel/2023/20230201162310_20230214_readthismanga-2023-2.png;I Don't Have Many Friends;僕は友達が少ない;TV;12;Finished Airing;Oct 7, 2011 to Dec 23, 2011;Fall 2011;Fridays at 01:55 (JST);['AIC', 'Media Factory', 'TBS', 'Bushiroad', 'Bandai Namco Games', 'Good Smile Company'];Funimation;AIC Build;Light novel;['Comedy', 'Romance', 'Ecchi'];['Harem', 'School'];24 min. per ep.;R+ - Mild Nudity;7.17;#3237;#211;777,260;3,728;;['Crunchyroll', 'Funimation', ''];When Kodaka Hasegawa finds out that he will be transferring to a new school, he is determined to make a positive impression, and maybe even some friends. However, Kodaka discovers he is out of luck when he immediately gets labeled as a violent delinquent due to his blond hair and intimidating expression. Although a month has passed, Kodaka is still alone thanks to his notorious reputation. However, his life begins to change when he finds fellow loner Yozora Mikazuki talking to her imaginary friend in an empty classroom.  After sharing stories of their lonely high school life, Kodaka and Yozora decide to overcome the difficulties of making friends together by starting the Neighbor's Club. Created for people who don't have friends, daily activities involve learning social skills and how to fit in, which will hopefully allow them to make friends. Joined by the eroge-loving Sena Kashiwazaki, and other eccentric outcasts, Kodaka may finally have managed to find people he can call friends, in this club filled with hilarious oddballs.  [Written by MAL Rewrite];
14;High School DxD BorN;https://myanimelist.net/anime/24703/High_School_DxD_BorN;https://cdn.myanimelist.net/resources/mxj_panel/2023/20230201162310_20230214_readthismanga-2023-2.png;High School DxD Third Season, High School DxD 3rd Season, Highschool DxD BorN;ハイスクールD×D BorN;TV;12;Finished Airing;Apr 4, 2015 to Jun 20, 2015;Spring 2015;Saturdays at 23:00 (JST);['Genco', 'Lantis', 'Movic', 'AT-X', 'Memory-Tech', 'Showgate', 'Fujimi Shobo', 'Kadokawa'];Funimation;TNK;Light novel;['Action', 'Comedy', 'Romance', 'Ecchi'];['Harem', 'Mythology', 'School'];24 min. per ep.;R+ - Mild Nudity;7.43;#1998;#225;760,078;3,837;;['Netflix'];The Red Dragon Emperor, Issei Hyoudou, and the Occult Research Club are back in action as summer break comes for the students of Kuoh Academy. After their fight with Issei’s sworn enemy, Vali and the Chaos Brigade, it is clear just how inexperienced Rias Gremory's team is. As a result, she and Azazel lead the club on an intense training regime in the Underworld to prepare them for the challenges that lie ahead.  While they slowly mature as a team, Issei will once again find himself in intimate situations with the girls of the Occult Research Club. Meanwhile, their adversaries grow stronger and more numerous as they rally their forces. And with the sudden appearance of Loki, the Evil God of Norse Mythology, the stage is set for epic fights and wickedly powerful devils in High School DxD BorN!  [Written by MAL Rewrite];
15;Shimoneta to Iu Gainen ga Sonzai Shinai Taikutsu na Sekai;https://myanimelist.net/anime/29786/Shimoneta_to_Iu_Gainen_ga_Sonzai_Shinai_Taikutsu_na_Sekai;https://cdn.myanimelist.net/resources/mxj_panel/2023/20230201162310_20230214_readthismanga-2023-2.png;Shimoseka;下ネタという概念が存在しない退屈な世界;TV;12;Finished Airing;Jul 4, 2015 to Sep 19, 2015;Summer 2015;Saturdays at 23:00 (JST);['Frontier Works', 'Shogakukan-Shueisha Productions', 'Genco', 'Starchild Records', 'AT-X', 'KlockWorx'];Funimation;J.C.Staff;Light novel;['Comedy', 'Ecchi'];['Gag Humor', 'School'];23 min. per ep.;R+ - Mild Nudity;7.24;#2864;#226;758,799;3,742;;['Funimation', 'Netflix'];With the introduction of strict new morality laws, Japan has become a nation cleansed of all that is obscene and impure. By monitoring citizens using special devices worn around their necks, authorities have taken extreme measures to ensure that society remains chaste.  In this world of sexual suppression, Tanukichi Okuma—son of an infamous terrorist who opposed the chastity laws—has just entered high school, offering his help to the student council in order to get close to president Anna Nishikinomiya, his childhood friend and crush. Little does he know that the vice president Ayame Kajou has a secret identity: Blue Snow, a masked criminal dedicated to spreading lewd material amongst the sheltered public—and Tanukichi has caught the girl's interest due to his father's notoriety.  Soon, Tanukichi is dragged into joining her organization called SOX, where he is forced to spread obscene propaganda, helping to launch an assault against the government's oppressive rule. With their school set as the first point of attack, Tanukichi will have to do the unthinkable when he realizes that their primary target is the person he admires most.  [Written by MAL Rewrite];
