;title;link;image_link;synonyms;japanese;type;episodes;status;aired;premiered;broadcast;producers;licensors;studios;source;genres;themes;duration;rating;score;ranked;popularity;members;favorites;demographic;platforms;synopsis;theme
37;Murenase! Seton Gakuen;https://myanimelist.net/anime/40483/Murenase_Seton_Gakuen;https://cdn.myanimelist.net/resources/mxj_panel/2023/20230201162310_20230214_readthismanga-2023-2.png;群れなせ！シートン学園;TV;12;Finished Airing;Jan 7, 2020 to Mar 24, 2020;Winter 2020;Tuesdays at 00:30 (JST);['Animax', 'Tokyo MX', 'Cygames', 'Legs', 'Happinet'];None found, add some;Studio Gokumi;Manga;['Comedy', 'Ecchi'];['Anthropomorphic', 'School'];;23 min. per ep.;PG-13 - Teens 13 or older;6.96;#4245;#1146;186,327;504;['Crunchyroll'];"Seton Academy is a place attended by a plethora of interesting and diverse animal species. Jin Mazama is one of the few humans there, who also happens to vehemently hate animals from the bottom of his heart! One day, he stumbles upon the rowdy and assertive girl Ranka Ookami, a small ""lone wolf"" without a pack, who has not a single friend.  The desperate Ranka tries to invite Jin into joining her pack; Jin, who hates animals, naturally refuses. Amid this situation, Jin meets Hitomi Hino, a fellow human, and promptly becomes infatuated with her. After getting to know each other, the two decide to create a cooking club, and after a few bad-blooded misunderstandings, Ranka soon joins the club as well.  Thus begins the howl-some and howl-arious story of two normal humans; an adorable wolf; a cheerful koala; a sluggish, blonde sloth; and a feline with cattitude in their newfound club—in a story that teaches that friendship can be forged by creatures of different kinds.  [Written by MAL Rewrite]";Come Together! to the Seton Academy;;
38;Nourin;https://myanimelist.net/anime/18095/Nourin;https://cdn.myanimelist.net/resources/mxj_panel/2023/20230201162310_20230214_readthismanga-2023-2.png;のうりん;TV;12;Finished Airing;Jan 11, 2014 to Mar 29, 2014;Winter 2014;Unknown;['Frontier Works'];Funimation;SILVER LINK.;Light novel;['Comedy', 'Romance', 'Ecchi'];['Parody', 'School'];;24 min. per ep.;PG-13 - Teens 13 or older;6.76;#5185;#1161;183,078;266;['Crunchyroll', 'Funimation'];Idol-obsessed Kousaku Hata is left devastated when his favorite, Yuka Kusakabe, unexpectedly announces her retirement at the peak of an illustrious career. As Yuka’s biggest fan, this news proves to be more difficult than he can bear. Shaken to his very core, he sinks into depression and places himself in self-imposed isolation. However, on the day his friends managed to convince him to attend school again, he gets a pleasant surprise.  It turns out that his beloved idol, under the guise of Ringo Kinoshita, has transferred into his class. This miraculous development fills Kousaku with newfound resolve, as he dedicates himself to take advantage of the once-in-a-lifetime opportunity. With the support of his teacher and friends, Kousaku works toward getting close to the girl of his dreams and uncovering the reason for her retirement from the entertainment industry.  [Written by MAL Rewrite];Agriculture and Forestry;;
39;Tenjou Tenge;https://myanimelist.net/anime/174/Tenjou_Tenge;https://cdn.myanimelist.net/resources/mxj_panel/2023/20230201162310_20230214_readthismanga-2023-2.png;天上天下;TV;24;Finished Airing;Apr 2, 2004 to Sep 17, 2004;Spring 2004;Unknown;['TV Asahi'];Discotek Media, Geneon Entertainment USA;Madhouse;Manga;['Action', 'Comedy', 'Ecchi'];['Martial Arts', 'School', 'Super Power'];Seinen;23 min. per ep.;R - 17+ (violence & profanity);6.88;#4601;#1167;182,500;592;['Crunchyroll'];For some people, high school represents the opportunity for a fresh start. You can take new classes and make new friends. For Souichiro Nagi and Bob Makihara, though, high school means something different: the chance to become the top fighters in the entire student body! Too bad Toudou Academy is the hardest possible place to realize their dreams. Their new high school is no ordinary academic institution. Rather than concentrating on classic subjects like math and science, Toudou Academy was created for the sole purpose of reviving the martial arts in Japan!  As a result, Souichiro's aspirations to become top dog are cut short when he runs afoul of Masataka Takayanagi and Maya Natsume. The two upperclassmen easily stop the freshmen duo's rampage across school, but rather than serving as a deterrent, it only stokes their competitive fire. What kind of monstrous fighters attend Toudou Academy? Are there any stronger than Masataka and Maya? And why in the world is Maya's younger sister stalking Souichiro? Learn the answers to these questions and more in Tenjou Tenge!;Heaven and Earth, Tenjo Tenge;;
40;Killing Bites;https://myanimelist.net/anime/34964/Killing_Bites;https://cdn.myanimelist.net/resources/mxj_panel/2023/20230201162310_20230214_readthismanga-2023-2.png;キリングバイツ;TV;12;Finished Airing;Jan 13, 2018 to Mar 31, 2018;Winter 2018;Saturdays at 02:25 (JST);['Sotsu', 'Mainichi Broadcasting System', 'NBCUniversal Entertainment Japan', 'Medicos Entertainment', 'Fields', 'KLab', 'Christmas Holly', 'C-one'];Sentai Filmworks;LIDENFILMS;Manga;['Action', 'Sci-Fi', 'Ecchi'];;Seinen;24 min. per ep.;R+ - Mild Nudity;6.57;#6210;#1194;178,764;439;[];After unknowingly participating in a kidnapping, college student Yuuya Nomoto finds his friends brutally murdered by Hitomi Uzaki, the high school girl they attempted to abduct. Forced to drive her to an undisclosed location, he finds himself being wagered as the prize for a death match between two Therianthropes, superpowered human-animal hybrids created through advanced gene therapy. As one of these hybrids, Hitomi uses the speed and fearlessness she gained from her ratel genes to viciously dispatch her foe and save Yuuya from certain death.  Waking up hours later hoping the whole event was only a nightmare, Yuuya realizes that he has become embroiled in a secret proxy war between four large Japanese business conglomerates, with the winner taking control of the economy. As her sole albeit unwilling investor, his life is now directly linked to Hitomi's ability to participate in underground bloodsport matches known only as Killing Bites.  [Written by MAL Rewrite];;Gore;
41;No Game No Life Specials;https://myanimelist.net/anime/24991/No_Game_No_Life_Specials;https://cdn.myanimelist.net/resources/mxj_panel/2023/20230201162310_20230214_readthismanga-2023-2.png;ノーゲーム・ノーライフ ミニ;Special;6;Finished Airing;Jun 25, 2014 to Nov 26, 2014;;;['Media Factory'];Sentai Filmworks;Madhouse;Light novel;['Comedy', 'Fantasy', 'Ecchi'];;;2 min. per ep.;PG-13 - Teens 13 or older;6.75;#5257;#1213;176,284;214;[];Picture drama specials included on the Blu-ray/DVD volumes.;NGNL Specials;Isekai;
42;Hyakka Ryouran: Samurai Girls;https://myanimelist.net/anime/8277/Hyakka_Ryouran__Samurai_Girls;https://cdn.myanimelist.net/resources/mxj_panel/2023/20230201162310_20230214_readthismanga-2023-2.png;百花繚乱 サムライガールズ;TV;12;Finished Airing;Sep 4, 2010 to Dec 20, 2010;Fall 2010;Unknown;['Genco', 'Lantis', 'Media Factory', 'Movic', 'Hobby Japan', 'Showgate', 'Gigno Systems'];Sentai Filmworks;Arms;Light novel;['Action', 'Comedy', 'Ecchi'];['Harem', 'Samurai', 'School'];;24 min. per ep.;R+ - Mild Nudity;6.77;#5157;#1219;175,247;286;['HIDIVE'];With its gorgeous landscape and prosperous people, Great Japan is the envy of all other nations. But a serious threat hovers over the country. Mysterious guardians known as Master Samurai are Great Japan's only defense.  At the behest of the student council, young samurai Muneakira Yagyuu arrives at Buou Academic School. Run by the Tokugawa Shogunate, here children of warriors are given aristocratic education required to run the country. The school is led by the student council president Yoshihiko Tokugawa and his sister Sen, who also happens to be Muneakira's childhood friend.  Upon arriving at the academy, Muneakira finds himself in the midst of a terrible fight. During the chaos, the sky fills with a peculiar white light and a mysterious girl named Juubei Yagyuu appears and suddenly kisses Muneakira. With his kiss, she awakens an unknown power that protects them.  Just who is this girl, and where did she come from? Muneakira finds himself entangled in the fate of the country and a threat that will shake Great Japan to its core. He must learn the secret behind the Master Samurai and the kiss that awakened Juubei's power in order to protect his country.  [Written by MAL Rewrite];Hyakka Ryouran: Samurai Girls;;
43;Megami-ryou no Ryoubo-kun.;https://myanimelist.net/anime/41812/Megami-ryou_no_Ryoubo-kun;https://cdn.myanimelist.net/resources/mxj_panel/2023/20230201162310_20230214_readthismanga-2023-2.png;女神寮の寮母くん。;TV;10;Finished Airing;Jul 14, 2021 to Sep 15, 2021;Summer 2021;Wednesdays at 23:30 (JST);['Media Factory', 'AT-X', 'Kadokawa Media House', 'Kadokawa'];Sentai Filmworks;asread.;Manga;['Comedy', 'Romance', 'Ecchi'];;Shounen;25 min. per ep.;R+ - Mild Nudity;6.52;#6520;#1236;173,421;1,207;['Crunchyroll', 'HIDIVE', '', '', '', '', '', ''];"Twelve-year-old Koushi Nagumo's life suddenly goes downhill when his father abandons him after their house burns down. Left to fend for himself, Koushi collapses on the street, but an eccentric woman named Mineru Wachi takes pity on him and brings him to the female dormitory ""Megami-ryou.""  After learning of Koushi's situation, Mineru, who happens to be the temporary manager, invites him to become Megami-ryou's official dormitory mother. However, what awaits him are the dorm's residents—each with their own wacky shenanigans—like the androphobic yet gentle Atena Saotome, the feminine tomboy Kiriya Senshou, and Mineru herself, whose recklessness knows no bounds when it comes to science. Despite this, Koushi does his best to fulfill the duties of this crazy new life!  [Written by MAL Rewrite]";;Harem;
44;C³;https://myanimelist.net/anime/10578/C%C2%B3;https://cdn.myanimelist.net/resources/mxj_panel/2023/20230201162310_20230214_readthismanga-2023-2.png;シーキューブ;TV;12;Finished Airing;Oct 1, 2011 to Dec 17, 2011;Fall 2011;Unknown;['Starchild Records'];Funimation;SILVER LINK.;Light novel;['Action', 'Comedy', 'Supernatural', 'Ecchi'];;;24 min. per ep.;R - 17+ (violence & profanity);6.59;#6107;#1244;172,125;258;['Crunchyroll', 'Funimation'];From the light novel series written by Minase Hazuki, comes a story of love, action, and comedy. Yachi Haruaki is a high school boy who is naturally resistant to curses. After his father sends him a mysterious black cube, Haruaki awakes to find a nude girl named Fear standing in his kitchen. She’s the human form of the cursed black cube – and an instrument of torture! Utilizing her special abilities, Fear fights alongside Haruaki to defeat other cursed instruments and their owners.  (Source: FUNimation);C3, C Cube, C^3;School;
45;To LOVE-Ru OVA;https://myanimelist.net/anime/5667/To_LOVE-Ru_OVA;https://cdn.myanimelist.net/resources/mxj_panel/2023/20230201162310_20230214_readthismanga-2023-2.png;To LOVEる -とらぶる-;OVA;6;Finished Airing;Apr 3, 2009 to Apr 2, 2010;;;['Shueisha'];None found, add some;Xebec;Manga;['Comedy', 'Sci-Fi', 'Ecchi'];['Harem', 'School'];Shounen;25 min. per ep.;R+ - Mild Nudity;7.26;#2795;#1257;170,405;281;[];Episode 01: Rito becomes a Woman Lala invents a gizmo to make her bust bigger. However, this invention of hers accidentally turns Rito into a woman.  Episode 02: Rito and Mikan Feeling lonely because Rito is always spending time with Lala, Mikan storms out of the house. While Rito and Lala are out looking for her a few flashbacks from the past, showing Rito and Mikan as kids, are shown.  Episode 03: Welcome to the Southern Resort!! Haruna wins an island resort trip for ten females. Rito gets turned into a dog by one of Lala's inventions and somehow ends up on the island as well.  Episode 04: Trouble Quest Rito and the girls become trapped inside an RPG game where the objective is to save Lala and defeat the evil witch Kyouko.  Episode 05: Nana and Momo Lala's sisters cause mischief for Rito and his harem at a cherry blossom viewing.  Episode 06: Draft, Metamorphose, Hand & Tail Yami and Yui confront with a senior, causing Yui to lose her panties.  Mikan finds Peke taking snapshots of new clothing while shopping. Suddenly, a stranger steals her bag.  As Rito tries to explore Lala's cleaned-up bedroom, he accidentally activates one of Lala's invention, fusing his hand to Lala's tail.;To-LOVE-Ru OVA, Trouble OVA, To Love You OVA;;
46;Hoshizora e Kakaru Hashi;https://myanimelist.net/anime/10079/Hoshizora_e_Kakaru_Hashi;https://cdn.myanimelist.net/resources/mxj_panel/2023/20230201162310_20230214_readthismanga-2023-2.png;星空へ架かる橋;TV;12;Finished Airing;Apr 11, 2011 to Jun 27, 2011;Spring 2011;Mondays at 09:00 (JST);['Dentsu', 'Sotsu', 'Marvelous', 'Pony Canyon', 'feng', 'PRA', 'Jumondo'];None found, add some;Doga Kobo;Visual novel;['Comedy', 'Romance', 'Ecchi'];['Harem', 'School'];;25 min. per ep.;PG-13 - Teens 13 or older;6.70;#5542;#1259;170,096;338;[];Kazuma Hoshino is preparing himself for a new stage of his life as a teenager. Because of his brother Ayumu's weaker than average health, their parents thought it best for the family to move out from the city to a more rural environment. Now the two brothers are off to the Yorozuyo Inn where they’ll be staying until their parents can settle affairs back in the city and set up their new home.  Their arrival to the inn doesn't go as planned though when they catch the wrong bus, wind up in the middle of nowhere, Ayumu gets his hat stolen by a wild monkey, and Kazuma gets lost in the woods trying to track the animal down. It all leads to a chance encounter with a spirited young girl named Ui, who Kazuma ends up accidentally falling onto and kissing while she tries leading him back to the bus stop. This hardly sits well with Ui’s friend Ibuki who swiftly kicks Kazuma and sends him on his way. Much to Kazuma's continued horror, his bad luck is perpetuated at the inn thanks to its landlady Senka and her slightly perverted sense of humor, and then finding out that two of his classmates are the girls he embarrassed himself in front of back in the woods!  Hoshizora e Kakaru Hashi finds Kazuma adapting to his new school, dealing with the multiple women who have entered his life, providing emotional support for his younger brother, and coping with living with his new landlady. However, for some reason, something about this place is bringing whispers of the past into Kazuma's mind. Small flashes back to a more innocent time and a friendship long forgotten. What could this déjà vu mean?;Hoshizora e Kakaru Hashi;;
47;Dungeon ni Deai wo Motomeru no wa Machigatteiru Darou ka OVA;https://myanimelist.net/anime/32801/Dungeon_ni_Deai_wo_Motomeru_no_wa_Machigatteiru_Darou_ka_OVA;https://cdn.myanimelist.net/resources/mxj_panel/2023/20230201162310_20230214_readthismanga-2023-2.png;ダンジョンに出会いを求めるのは間違っているだろうか OVA「ダンジョンに温泉を求めるのは 間違っているだろうか」;OVA;1;Finished Airing;Dec 7, 2016;;;['Genco', 'Movic', 'Warner Bros. Japan', 'KlockWorx', 'SoftBank Creative', 'MAGES.', 'Hakuhodo DY Music & Pictures', 'FuRyu'];Sentai Filmworks;J.C.Staff;Light novel;['Adventure', 'Comedy', 'Fantasy', 'Ecchi'];;;24 min.;PG-13 - Teens 13 or older;7.05;#3827;#1273;167,489;135;['HIDIVE'];On their way back from the 18th floor, Hestia, Bell, and the others accidentally uncover a hidden, mystical hot spring, and they decide to stop by to refresh themselves until creatures lurking in the dark appear to attack them.;DanMachi OVA, Is It Wrong to Try to Pick Up Girls in a Dungeon? OVA, Dungeon ni Deai wo Motomeru no wa Machigatteiru Darou ka: Dungeon ni Onsen wo Motomeru no wa Machigatteiru Darou ka;;
48;Trinity Seven Movie 1: Eternity Library to Alchemic Girl;https://myanimelist.net/anime/33581/Trinity_Seven_Movie_1__Eternity_Library_to_Alchemic_Girl;https://cdn.myanimelist.net/resources/mxj_panel/2023/20230201162310_20230214_readthismanga-2023-2.png;劇場版 トリニティセブン －悠久図書館〈エターニティライブラリー〉と錬金術少女〈アルケミックガール〉－;Movie;1;Finished Airing;Feb 25, 2017;;;['Sotsu', 'Avex Pictures'];None found, add some;Seven Arcs Pictures;Manga;['Action', 'Comedy', 'Fantasy', 'Romance', 'Ecchi'];['Harem', 'School'];Shounen;55 min.;PG-13 - Teens 13 or older;7.25;#2838;#1277;167,207;249;['Crunchyroll'];"The film's story begins when Arata inadvertently touches ""Hermes Apocrypha,"" Lilith's Grimoire. Suddenly, he is enveloped by a bright white light, and a girl appears before him. She calls herself Lilim, and treats both Arata and Lilith as her parents. At the same time she appears, something changes in the world. The forbidden Eternal Library awakens. In the Library is sealed the ultimate culmination of Alchemy, the White Demon Lord. The White Demon Lord plots to eliminate Arata and the Trinity Seven to usurp the position of Demon Lord. Bristling with untold power, the White Demon Lord attacks Arata, and triggers a desperate crisis where Arata and the Trinity Seven must save the world in this last battle.  (Source: ANN)";Gekijouban Trinity Seven, Trinity Seven Movie: Yuukyuu Toshokan to Rekinjutsu Shoujo;;
49;Strike Witches;https://myanimelist.net/anime/3667/Strike_Witches;https://cdn.myanimelist.net/resources/mxj_panel/2023/20230201162310_20230214_readthismanga-2023-2.png;ストライクウィッチーズ;TV;12;Finished Airing;Jul 4, 2008 to Sep 19, 2008;Summer 2008;Fridays at 01:20 (JST);['GDH', 'Kadokawa Shoten', 'KlockWorx', 'NTT Docomo'];Funimation;Gonzo;Original;['Action', 'Sci-Fi', 'Ecchi'];;;24 min. per ep.;R+ - Mild Nudity;6.96;#4257;#1286;165,154;1,048;['Funimation'];"In the year 1939, humanity was on the verge of destruction. Equipped with weapons of devastating power, a mysterious alien race, known as the Neuroi, began an invasion of the Earth, ravaging the planet, obliterating countries, and vanquishing human armies. To counter this seemingly unstoppable force, the world's powers united. A new device was produced, called the Striker Unit, capable of facing Neuroi technology. Girls equipped with the Striker Unit became known as the Witches, forming humanity's last line of defense. They began their fight against the Neuroi, utilizing their now-enhanced magical abilities, flaunting destructive weapons no human could manage.  Fast forward to 1944—Yoshika Miyafuji is a young teenage girl who eventually decides to join the 501st Joint Fighter Wing, known as the ""Strike Witches."" With no formal training however, can Miyafuji learn to cooperate with her fellow Strike Witches? And if so, can she save humanity from the Neuroi onslaught?  [Written by MAL Rewrite]";;Military;
50;Saikin, Imouto no Yousu ga Chotto Okashiinda ga.;https://myanimelist.net/anime/17777/Saikin_Imouto_no_Yousu_ga_Chotto_Okashiinda_ga;https://cdn.myanimelist.net/resources/mxj_panel/2023/20230201162310_20230214_readthismanga-2023-2.png;最近、妹のようすがちょっとおかしいんだが。;TV;12;Finished Airing;Jan 4, 2014 to Mar 23, 2014;Winter 2014;Unknown;['Lantis', 'Magic Capsule'];Discotek Media, Crunchyroll;Project No.9;Manga;['Comedy', 'Romance', 'Supernatural', 'Ecchi'];;Shounen;23 min. per ep.;PG-13 - Teens 13 or older;6.21;#8344;#1292;164,317;188;[];Saikin, Imouto no Yousu ga Chotto Okashiinda ga. follows a family just starting to rebuild. When they marry, Mr. and Mrs. Kanzaki bring a teenage son and daughter along for the ride. But high school freshman Mitsuki Kanzaki is less than thrilled. Stinging from a history of absent and abusive father figures, she is slow to accept her stepfather and stepbrother.  But after an accident lands Mitsuki in the hospital, she finds herself possessed by the ghost of Hiyori Kotobuki, a girl her age who was deeply in love with Mitsuki's stepbrother Yuuya. Hiyori cannot pass on to her final reward because of her unrequited love for Yuuya, meaning she's got to consummate it... in Mitsuki's body?!  Now, Mitsuki's life depends on getting Hiyori to Heaven. But will she get used to sharing herself with a pushy, amorous ghost? Can she overcome her distrust of her new family? Can she bring herself to fulfill Hiyori's feelings for Yuuya? And might she be hiding some feelings of her own?;Recently, My Little Sister is Unusual, ImoCho, ImoCyo;;
51;Fairy Tail OVA;https://myanimelist.net/anime/9982/Fairy_Tail_OVA;https://cdn.myanimelist.net/resources/mxj_panel/2023/20230201162310_20230214_readthismanga-2023-2.png;フェアリーテイル OVA;OVA;5;Finished Airing;Apr 15, 2011 to Jun 17, 2013;;;['None found', 'add some'];None found, add some;Satelight, A-1 Pictures;Manga;['Comedy', 'Fantasy', 'Ecchi'];;Shounen;27 min. per ep.;PG-13 - Teens 13 or older;7.47;#1817;#1311;162,075;441;[];When the members of Fairy Tail aren't destroying towns or defeating powerful foes, they're attending school, travelling back in time, visiting water parks, and taking on odd jobs from strange clients. No matter where they go, a fun adventure always awaits, sometimes in the most unexpected form!  [Written by MAL Rewrite];Fairy Tail: Youkoso Fairy Hills!, Yousei Gakuen: Yankee-kun to Yankee-chan;;
52;Okusama ga Seitokaichou!+!;https://myanimelist.net/anime/32603/Okusama_ga_Seitokaichou_;https://cdn.myanimelist.net/resources/mxj_panel/2023/20230201162310_20230214_readthismanga-2023-2.png;おくさまが生徒会長!＋!;TV;12;Finished Airing;Oct 2, 2016 to Dec 18, 2016;Fall 2016;Sundays at 22:30 (JST);['DAX Production', 'Dream Creation', 'Studio CHANT'];None found, add some;Seven;Manga;['Comedy', 'Romance', 'Ecchi'];;Shounen;8 min. per ep.;R+ - Mild Nudity;6.59;#6083;#1318;161,085;120;[];The story begins with Izumi Hayato running to be student council president. But when a beautiful girl swings in promising the liberalization of love while flinging condoms into the audience, he ends up losing to her and becoming the vice president. At the student council meeting, the newly-elected president invites herself over to Izumi's house, where she promptly announces she is to become Izumi's wife thanks to an agreement—facilitated by alcohol—made between their parents when they were only 3.  (Source: MAL Scanlations);My Wife is the Student Council President 2nd Season, Oku-sama ga Seito Kaichou! 2nd Season, Okusama ga Seitokaichou! Plus;School;
53;Midori no Hibi;https://myanimelist.net/anime/330/Midori_no_Hibi;https://cdn.myanimelist.net/resources/mxj_panel/2023/20230201162310_20230214_readthismanga-2023-2.png;美鳥の日々;TV;13;Finished Airing;Apr 4, 2004 to Jun 27, 2004;Spring 2004;Unknown;['Bandai Visual', 'Lantis'];Media Blasters, NYAV Post;Pierrot;Manga;['Comedy', 'Drama', 'Romance', 'Ecchi'];;Shounen;24 min. per ep.;R+ - Mild Nudity;7.23;#2941;#1321;160,932;626;[];"There isn't a single person in Sakuradamon High who hasn't heard the legends about Seiji ""The Mad Dog"" Sawamura's demonically powerful right hand. His reputation makes it fairly difficult for him to approach girls, and after being rejected 20 times straight, he half-jokingly vows to finish high school with his right hand for a girlfriend.  Much to his surprise, after waking up the next morning, Seiji discovers that his demon right hand has mysteriously turned into a miniature girl, Midori Kasugano, who reveals that she has had a crush on Seiji for the past three years. Because their situation is not ideal for either of them, Seiji attempts to return Midori to normal. But after causing a big misunderstanding at the Kasugano household, the pair decide to keep their predicament between them until a solution is found. Thus begins an odd relationship, and what could be the only chance for Midori to finally be with the one she loves.  [Written by MAL Rewrite]";My Days With Midori;;
54;Freezing Vibration;https://myanimelist.net/anime/18001/Freezing_Vibration;https://cdn.myanimelist.net/resources/mxj_panel/2023/20230201162310_20230214_readthismanga-2023-2.png;フリージング ヴァイブレーション;TV;12;Finished Airing;Oct 4, 2013 to Dec 20, 2013;Fall 2013;Fridays at 21:30 (JST);['Media Factory', 'Eswood', 'Kill Time Communication'];Funimation;A.C.G.T.;Manga;['Action', 'Drama', 'Romance', 'Sci-Fi', 'Ecchi'];;Seinen;23 min. per ep.;R+ - Mild Nudity;6.73;#5372;#1323;160,797;196;[];Ever since the 10th NOVA clash, the Chevalier had concluded that the NOVA have been appearing at a steadier rate and they are losing more Pandoras than they can produce. Their solution is the E-Pandora Project which involves normal humans being given the power to become Pandoras. Inviting Pandora from around the world to their Alaskan base witness the unveiling of their new project, Satellizer, Kazuya and Rana are among those who have been summoned. However, as time goes the E-Pandora Project starts to become fishier and the Pandoras start to grow more and more concerned...;Freezing Season 2;Military;
