;title;link;image_link;synonyms;japanese;type;episodes;status;aired;premiered;broadcast;producers;licensors;studios;source;genres;themes;demographic;duration;rating;score;ranked;popularity;members;favorites;platforms;synopsis;theme;genre
32;Jigoku Sensei Nube: Kyoufu no Natsuyasumi!! Ayashi no Umi no Densetsu!;https://myanimelist.net/anime/5296/Jigoku_Sensei_Nube__Kyoufu_no_Natsuyasumi_Ayashi_no_Umi_no_Densetsu;https://cdn.myanimelist.net/resources/mxj_panel/2023/20230201162310_20230214_readthismanga-2023-2.png;Jigoku Sensei Nube;地獄先生ぬ～べ～　恐怖の夏休み！！妖しの海の伝説！;Movie;1;Finished Airing;Jul 12, 1997;['None found', 'add some'];None found, add some;Toei Animation;Unknown;['Action', 'Horror', 'Supernatural'];38 min.;R - 17+ (violence & profanity);6.76;#5220;#9877;2,415;0;;Shounen;[];When Nube and his class arrive at a small island to carry out beach activities, they heard a forbodding tale from an old man residing on the island. Legend has it that there is a creature known as the sea spider in the open seas around the island. When the creature is past 200 years old, it will turn into a monster and devour humans to satisfy its appetite. However, curiousity kills the cat and Yukime decides to pursue the authenticity of the legend. And then, a girl suddenly appears on the beach. Possessed with a strange charm, she immediately attracts Hiroshi's attention and overcomes him. Soon later, strange things start to happen to the others whereby Kyoko and Ritsuko-sensei got attacked under strange circumstances. The true identity behind the mysterious girl is questioned and the legend behind the sea creature seems to be true after all.;;;School;;
33;Choujin Densetsu Urotsukidouji 5: Kanketsu-hen;https://myanimelist.net/anime/2345/Choujin_Densetsu_Urotsukidouji_5__Kanketsu-hen;https://cdn.myanimelist.net/resources/mxj_panel/2023/20230201162310_20230214_readthismanga-2023-2.png;Urotsukidoji V - The Final Chapter;超神伝説うろつき童子 完結篇;OVA;1;Finished Airing;Dec 28, 1996;['None found', 'add some'];None found, add some;Phoenix Entertainment;Unknown;['Fantasy', 'Horror', 'Hentai'];51 min.;Rx - Hentai;5.26;N/A;#9940;2,368;1;;;[];Only one episode of this was partially completed, the released version containing numerous examples of animation that is missing in-between frames. The story as such concerned the arrival of the real Chojin as he/she (a hermaphrodite) makes moves to wipe out all life on Earth.  Interestingly, the setup for the show was far more heavily connected with the first two, more popular, chapters in the Urotsukidoji saga, with appearances by Nagumo and Akemi (unseen since the early episodes of Part III), and redesigned character models that more closely resembled the earlier episodes. Some of the less popular characters introduced in chapters III and IV, particularly Buju, were nowhere to be seen. Nevertheless, such strategies did little to get this final saga off the ground and the story was shelved.  (Source: Wikipedia);;;Mythology;;
34;Kaibutsu Oujo Specials;https://myanimelist.net/anime/26063/Kaibutsu_Oujo_Specials;https://cdn.myanimelist.net/resources/mxj_panel/2023/20230201162310_20230214_readthismanga-2023-2.png;Princess Resurrection: Kerberotte Specials, Princess Resurrection (OVA) ;怪物王女;Special;3;Finished Airing;Dec 9, 2010 to Oct 7, 2011;['None found', 'add some'];None found, add some;Tatsunoko Production;Unknown;['Adventure', 'Comedy', 'Horror', 'Supernatural'];4 min. per ep.;R - 17+ (violence & profanity);6.51;#6604;#9942;2,366;2;;Shounen;[];Specials of 4 minutes which recounts the adventures of Kerberotte-chan including characters of Princess Resurrection.;;;;;
35;Dead Girl Trailer;https://myanimelist.net/anime/16602/Dead_Girl_Trailer;https://cdn.myanimelist.net/resources/mxj_panel/2023/20230201162310_20230214_readthismanga-2023-2.png;;DEAD GIRL Trailer（デッド・ガール トレーラー）;ONA;1;Finished Airing;May 22, 2011;['None found', 'add some'];None found, add some;None found, add some;Original;['Horror', 'Supernatural', 'Suspense'];1 min.;R - 17+ (violence & profanity);3.51;#13722;#9952;2,357;0;;;[];Once upon a time, a girl was brutally murdered. Stabbed mercilessly and left for dead, she never received justice and her sadistic killer got away. That was until, through supernatural and unknown forces, she was brought back to life—as a zombie! Powerful, relentless, and hungry, Dead Girl is out for revenge!  [Written by MAL Rewrite];;;Parody;;
36;Hell Target;https://myanimelist.net/anime/11411/Hell_Target;https://cdn.myanimelist.net/resources/mxj_panel/2023/20230201162310_20230214_readthismanga-2023-2.png;;HELL TARGET [ヘルターゲット];OVA;1;Finished Airing;Jan 21, 1987;['None found', 'add some'];None found, add some;Nakamura Production;Unknown;['Horror', 'Sci-Fi'];50 min.;R - 17+ (violence & profanity);4.58;#13503;#9982;2,334;9;;;[];A spaceship is lost near the forbidden planet of Inferno II. Some years later, a second ship with a crew of nine gets there and encounters a monster that rapidly makes mince meat of most of them. The sole survivor, Makurou Kitazato, must destroy the monster before it can surprise a third ship that is already en route.  (Source: AniDB);;;Space;;
37;Youjuu Sensen Adventure Kid;https://myanimelist.net/anime/2977/Youjuu_Sensen_Adventure_Kid;https://cdn.myanimelist.net/resources/mxj_panel/2023/20230201162310_20230214_readthismanga-2023-2.png;Adventure Duo;妖獣戦線アドベンチャーKID;OVA;3;Finished Airing;Jul 21, 1992 to Oct 21, 1993;['None found', 'add some'];Central Park Media;None found, add some;Manga;['Fantasy', 'Horror', 'Hentai'];37 min. per ep.;Rx - Hentai;5.24;N/A;#10025;2,294;4;;;[];Episode 1: A young man named Norikazu finds a computer from World War II buried in his back garden. When he activates it, he and a girl named Midori are transported to Hell where erotic creatures and monsters of different kinds live. They meet some friends including a sexy elf type woman named Eganko who falls in love with Norikazu, and a perverted monster prince who is soon enslaved by Midori. Using their new friends the pair try to make the dangerous journey back home.  Episode 2: Having made their way back home the adventure duo find the world they knew is gone, and is now ruled by the demonic computer which first sent them to Hell. They travel back in time to World War II Japan in an attempt to stop the world from being changed. Notably, in doing so they witness the atomic bomb being dropped on Hiroshima, and there is an appearance of the Enola Gay, as well as numerous symbols of Japanese culture at the time.  Episode 3: This episode has a humorous love-quadrangle plot, where Eganko comes up with a plan to make Norikazu fall in love with her with a love potion, and simultaneously make Midori fall in love with an egotistical young man from her school. Unsurprisingly their plan backfires and everyone gets what they deserve.  (Source: Wikipedia);;;Mythology;;
38;Aru Zombie Shoujo no Sainan PV;https://myanimelist.net/anime/31014/Aru_Zombie_Shoujo_no_Sainan_PV;https://cdn.myanimelist.net/resources/mxj_panel/2023/20230201162310_20230214_readthismanga-2023-2.png;The Misfortune of a Certain Zombie Girl;あるゾンビ少女の災難;ONA;1;Finished Airing;Jul 1, 2012;['None found', 'add some'];None found, add some;None found, add some;Light novel;['Action', 'Horror'];45 sec.;PG-13 - Teens 13 or older;4.85;#13219;#10058;2,268;2;;;[];Promotional video for an anime adaptation of the Aru Zombie Shoujo novel series. Though uploaded in July 2012, the proposed adaptation never came to fruition.;;;;;
39;Eguchi Hisashi no Nantoka Narudesho!;https://myanimelist.net/anime/5554/Eguchi_Hisashi_no_Nantoka_Narudesho;https://cdn.myanimelist.net/resources/mxj_panel/2023/20230201162310_20230214_readthismanga-2023-2.png;;江口寿史のNANTOKA NARUDESHO!;OVA;1;Finished Airing;Jan 25, 1990;['None found', 'add some'];None found, add some;Madhouse;Manga;['Comedy', 'Horror', 'Supernatural'];33 min.;R+ - Mild Nudity;4.67;#13425;#10091;2,248;4;;Shoujo;[];Part anime, part live action, and part puppet show. This MAL entry duration will reflect the anime segment only. Nantoka Narudesho is a series of seemingly unrelated sketches. Viewer-be-warned, some sketches have not aged well and would be found extremely offensive due to racism, sexual depravity, and homophobia.;;;Parody;;
40;Shin Choujin Densetsu Urotsukidouji Mataiden;https://myanimelist.net/anime/2342/Shin_Choujin_Densetsu_Urotsukidouji_Mataiden;https://cdn.myanimelist.net/resources/mxj_panel/2023/20230201162310_20230214_readthismanga-2023-2.png;Legend of the Demon Womb;真・超神伝説 うろつき童子・魔胎伝;OVA;2;Finished Airing;Dec 1, 1990 to Apr 10, 1991;['None found', 'add some'];Central Park Media;Phoenix Entertainment;Unknown;['Fantasy', 'Horror', 'Sci-Fi', 'Hentai'];47 min. per ep.;Rx - Hentai;5.59;N/A;#10119;2,234;3;;;[];"Nazi Germany, 1944: As American bombers soar towards Berlin, a revolting Satanic rite takes place below—Hitler and his minions are using the monstrous Nazi Death Rape Machine to render the dimensional boundaries separating the Human World from the World of Man-Beasts and the World of Monster Demons. Dr. Munhihausen Sr.'s life work is about to come to fruition—the conjuring of the Overfiend!  Cut to modern day Tokyo—Munhihausen Jr. searches for a monster with strength enough to conquer the omnipotent Overfiend. Since legend says that he who kills the Overfiend will rule all three worlds forever; Munhihausen is determined to slay the Overfiend and assume complete control over all three dimensions. His efforts seem fruitless—until Nagumo's cousin Takeaki, infused with Nagumo's blood after an accident, begins to develop monstrous powers.  As man-beast Amano Jyaku and his sister Megumi, together with faithful accomplice Kuroko attempt to thwart Munhihausen's evil plan, nothing seems likely to prevent Munhihausen, descendant of a race of brutal tyrants, from enslaving the world under his despicable rule!";;;Mythology;;
41;Shin Kujakuou;https://myanimelist.net/anime/3599/Shin_Kujakuou;https://cdn.myanimelist.net/resources/mxj_panel/2023/20230201162310_20230214_readthismanga-2023-2.png;Spirit Warrior: Peacock King;真・孔雀王;OVA;2;Finished Airing;May 20, 1994 to Jun 17, 1994;['Pony Canyon', 'Pioneer LDC', 'Shueisha'];Central Park Media;Madhouse;Unknown;['Action', 'Horror'];55 min. per ep.;R+ - Mild Nudity;5.81;#10355;#10121;2,230;1;;;[];A young mystic without a past, Kujaku was born under a dark omen possessed of incredible supernatural powers. Raised by priests, he has learned to use these powers for good. But the evil Siegfried von Mittgard seeks to steal his birthright, and rule the world as the Regent of Darkness. He has dispatched bloodthirsty minions to destroy Kujaku before he can awaken to his destiny. Now, Kujaku must unravel the riddle of his past, before the power within consumes him!  (Source: AniDB);;;Mythology;;
42;Jigoku Sensei Nube: Gozen 0 Ji Nube Shisu!;https://myanimelist.net/anime/8228/Jigoku_Sensei_Nube__Gozen_0_Ji_Nube_Shisu;https://cdn.myanimelist.net/resources/mxj_panel/2023/20230201162310_20230214_readthismanga-2023-2.png;;地獄先生ぬ～べ～　午前0時ぬ～べ～死す！！;Movie;1;Finished Airing;Mar 8, 1997;['None found', 'add some'];None found, add some;Toei Animation;Manga;['Adventure', 'Comedy', 'Horror', 'Supernatural'];45 min.;PG-13 - Teens 13 or older;6.79;#5059;#10134;2,223;2;;Shounen;[];New student comes to Nube class. His name is Jun and he's a lonely boy who loves clowns very much. His only friend is a Pierre - clown in the mirror. And one night Pierre gives Jun a mask with strange abilities. At that point Jun starts to act strange and lot of accidents occur in the school.;;;School;;
43;Zonmi-chan: Meat Pie of the Dead;https://myanimelist.net/anime/32934/Zonmi-chan__Meat_Pie_of_the_Dead;https://cdn.myanimelist.net/resources/mxj_panel/2023/20230201162310_20230214_readthismanga-2023-2.png;;【ゾンミちゃん】 - ミートパイ オブ ザ デッド -;Special;1;Finished Airing;Mar 26, 2016;['None found', 'add some'];None found, add some;Neft Film;Original;['Comedy', 'Horror', 'Supernatural'];5 min.;PG-13 - Teens 13 or older;5.15;#12719;#10166;2,202;0;;;[];A heart-warming splatter comedy about a zombie in love!  Zonmi-chan is a clumsy, careless, but cute girl. Sometimes she takes a bite out of the guy she likes. Oh, that's right, Zonmi-chan is a zombie girl.  (Source: Neft Film);;;;;
44;Youjuu Kyoushitsu;https://myanimelist.net/anime/2338/Youjuu_Kyoushitsu;https://cdn.myanimelist.net/resources/mxj_panel/2023/20230201162310_20230214_readthismanga-2023-2.png;;妖獣教室;OVA;6;Finished Airing;May 25, 1990 to May 27, 1994;['None found', 'add some'];Central Park Media, Critical Mass Video;None found, add some;Manga;['Horror', 'Hentai'];45 min. per ep.;Rx - Hentai;5.16;N/A;#10192;2,182;3;;;[];Demons take multiple forms, in this case there's one thats the mightest of all and has to be satisfied with the flesh of woman. He searches for his preys in the form of a woman, so they won't be feared.  (Source: ANN);;;Mythology;;
45;Gakkou no Kaidan Recaps;https://myanimelist.net/anime/22055/Gakkou_no_Kaidan_Recaps;https://cdn.myanimelist.net/resources/mxj_panel/2023/20230201162310_20230214_readthismanga-2023-2.png;Gakkou no Kaidan: New Year's Special;学校の怪談　総集編;Special;2;Finished Airing;Nov 15, 2000 to Jan 3, 2001;['None found', 'add some'];None found, add some;Pierrot;Original;['Horror', 'Mystery', 'Supernatural'];25 min. per ep.;PG-13 - Teens 13 or older;6.10;#8945;#10286;2,112;0;;;[];A new year special where Momoko stars to remember some of the adventures, she has had with her friends.;;;;;
46;Yami no Purple Eye;https://myanimelist.net/anime/9509/Yami_no_Purple_Eye;https://cdn.myanimelist.net/resources/mxj_panel/2023/20230201162310_20230214_readthismanga-2023-2.png;;闇のパープル・アイ;Music;1;Finished Airing;1987;['Youmex'];None found, add some;J.C.Staff;Manga;['Horror', 'Mystery', 'Supernatural'];31 min.;PG-13 - Teens 13 or older;4.55;#13518;#10305;2,100;3;['Music', 'Psychological'];Shoujo;[];Based on a shoujo manga written and illustrated by Shinohara Chie serialised in Shoujo Comic.  The original story follows the struggles of a teenage girl after she finds herself turning into a lycanthropy-leopard and having to battle her newly found predatory instincts.  In 1987 an animated music video of 30 minutes length was made based on the award winning manga.  (Source: AniDB);;;;;
47;Dead World;https://myanimelist.net/anime/34060/Dead_World;https://cdn.myanimelist.net/resources/mxj_panel/2023/20230201162310_20230214_readthismanga-2023-2.png;;;ONA;1;Finished Airing;Sep 16, 2016;['None found', 'add some'];None found, add some;None found, add some;Original;;1 min.;R - 17+ (violence & profanity);3.51;#13723;#10346;2,073;1;;;[];In the forest ...;;;;Horror;
48;Hengen Taima Yakou Karura Mau! Nara Onryou Emaki;https://myanimelist.net/anime/3178/Hengen_Taima_Yakou_Karura_Mau_Nara_Onryou_Emaki;https://cdn.myanimelist.net/resources/mxj_panel/2023/20230201162310_20230214_readthismanga-2023-2.png;Karura Dance, Hengentai Mayakou Karura Mau! Nara Onryou Emaki, Hengentaimayakou Karuramau! Naraon'ryouemaki;変幻退魔夜行 カルラ舞う！ 奈良怨霊絵巻;Movie;1;Finished Airing;Apr 8, 1989;['Toshiba Entertainment'];None found, add some;None found, add some;Manga;['Action', 'Adventure', 'Fantasy', 'Horror', 'Supernatural'];1 hr. 18 min.;R - 17+ (violence & profanity);6.37;#7458;#10353;2,066;2;;Shoujo;[];"Shoko and Maiko Ougi are apparently two ordinary schoolgirls in pursuit of graduating and having fun. Shii-chan is the more serious while Mai-chan is more fun-loving. In reality, the two sisters are powerful exorcists from the Karura temple. Each wields half the power...Shii-chan can ""see"" the spirits, and Mai-chan can banish them. This is the movie adaptation of a spooky series with heavy emphasis on traditionally Japanese occult themes.  (Source: AnimeNfo's Karura Mau OVA description; modified)";;;Mythology;;
49;Kyoufu Shinbun (2014);https://myanimelist.net/anime/30463/Kyoufu_Shinbun_2014;https://cdn.myanimelist.net/resources/mxj_panel/2023/20230201162310_20230214_readthismanga-2023-2.png;;恐怖新聞 (2014);ONA;16;Finished Airing;Apr 28, 2014 to Aug 1, 2014;['None found', 'add some'];None found, add some;Next Media Animation;Unknown;['Fantasy', 'Horror', 'Supernatural'];10 min. per ep.;PG-13 - Teens 13 or older;5.48;#11727;#10358;2,064;6;;;['Crunchyroll'];"Rei Kigata is a first year middle schooler at Ishido Middle School. He is not a believer of any paranormal phenomena such as existence of ghosts or spirits in any kind, but one day at midnight, while he is sleeping, a mysterious newspaper called ""Horror News"" is delivered to his room. The newspaper tells a story in which one of his teachers at the school will get killed in a car accident the following morning and Kigata will be a witness of the accident. The story turns into a fact in the following day and since then, the mysterious newspaper is delivered everyday. He realizes he is haunted by this newspaper and that his life span would be shortened in 100 days every time he reads it.  (Source: Crunchyroll, edited)";;;Mythology;;
50;Chainsaw Maid Episode 0;https://myanimelist.net/anime/37742/Chainsaw_Maid_Episode_0;https://cdn.myanimelist.net/resources/mxj_panel/2023/20230201162310_20230214_readthismanga-2023-2.png;Chainsaw Maid Gaiden Episode 0;チェーンソーメイド外伝 エピソード0;Special;1;Finished Airing;Oct 29, 2010;['Pony Canyon'];None found, add some;None found, add some;Original;['Comedy', 'Horror', 'Supernatural', 'Suspense'];3 min.;R - 17+ (violence & profanity);4.99;#13019;#10364;2,058;1;;;[];A special episode included on the Chainsaw Maid DVD.;;;;;
51;Youshou;https://myanimelist.net/anime/3536/Youshou;https://cdn.myanimelist.net/resources/mxj_panel/2023/20230201162310_20230214_readthismanga-2023-2.png;;妖囁;OVA;2;Finished Airing;Feb 11, 2001 to Jan 2, 2002;['D3', 'Mediabank'];Critical Mass Video;None found, add some;Unknown;['Horror', 'Hentai'];25 min. per ep.;Rx - Hentai;5.13;N/A;#10413;2,024;2;;;[];Justice has never been so naked!  A super-secret cult of lesbians performs erotic experiments on bodies from the local hospital! Their purpose: to revive the spirit of their ancient leader in a virile human form. Now it's up to the Midnight Strike Force, a team of busty justice fighters, to go undercover (and under the covers) to stop the nefarious acolytes before they succeed in their diabolically dirty schemes!  (Source: Critical Mass Video);;;Mythology;;
52;Uchida Shungicu no Noroi no One-Piece;https://myanimelist.net/anime/41340/Uchida_Shungicu_no_Noroi_no_One-Piece;https://cdn.myanimelist.net/resources/mxj_panel/2023/20230201162310_20230214_readthismanga-2023-2.png;Cursed Dress, Uchida Shungiku no Noroi no Onepiece;内田春菊の呪いのワンピース;Special;1;Finished Airing;Aug 25, 1992;['TBS'];None found, add some;Kyoto Animation, Shin-Ei Animation;Manga;['Horror', 'Romance'];23 min.;PG-13 - Teens 13 or older;5.77;#10522;#10420;2,020;5;;Shoujo;[];An omnibus horror TV special where three girls encounter a beautiful rose patterned yellow one-piece dress which curses them as they try to gain the attention of a man they like in their lives.;;;;;
53;Si Ling Bianma: Shijie Caozong Zhe;https://myanimelist.net/anime/33508/Si_Ling_Bianma__Shijie_Caozong_Zhe;https://cdn.myanimelist.net/resources/mxj_panel/2023/20230201162310_20230214_readthismanga-2023-2.png;;死灵编码;ONA;12;Finished Airing;Dec 19, 2013 to Jun 4, 2014;['Yaoqi'];None found, add some;Foch Films;Original;['Fantasy', 'Horror', 'Mystery'];9 min. per ep.;R - 17+ (violence & profanity);5.29;#12350;#10475;1,990;0;['Parody', 'Psychological', 'Video Game'];;[];“Ghost” is an online mobile game that Ye Yinyi always dreamed of completing, and to that end, has poured his blood and tears into it, even missing a date with his girlfriend. However, he learns about an alarming monster attack on a young woman near his house, a photograph of which shows the monster to bear a resemblance to the monster he designed. Why is the world of his mobile game appearing in real life?;;;;;
54;Genma Taisen: Shinwa Zenya no Shou;https://myanimelist.net/anime/1705/Genma_Taisen__Shinwa_Zenya_no_Shou;https://cdn.myanimelist.net/resources/mxj_panel/2023/20230201162310_20230214_readthismanga-2023-2.png;Genma Taisen, Genma Wars: Eve of Mythology, Ghenma Wars, Great War of the Demon of Illusions: The Chapter of the Previous Night of the Myth;幻魔大戦－神話前夜の章;TV;13;Finished Airing;Feb 2, 2002 to May 11, 2002;['KENMedia'];Media Blasters;E&G Films;Manga;['Adventure', 'Drama', 'Horror', 'Sci-Fi', 'Supernatural'];25 min. per ep.;PG-13 - Teens 13 or older;5.00;#12998;#10515;1,969;1;;Shounen;[];In the distant future, monsters and inhumans roam the land, and the ruling Evil King seeks a human woman to bear him powerful, force-adept heirs. Non offers herself to the Evil King in order to save her village from Ape Clan raiders, and gives him twin sons, Loof and Jin. She and her sons are exiled by the ungrateful villagers, however, and Non's companion Nue (a Demon Clan member changed into a wolf for disobedience) takes Loof to be raised by his father, the Evil King. The Evil One's Queen Parome despises humans, however, and her malevolence towards Loof deepens...  (Source: AnimeNfo);Winter 2002;Unknown;;;
55;Inuki Kanako Zekkyou Collection: Gakkou ga Kowai!;https://myanimelist.net/anime/8920/Inuki_Kanako_Zekkyou_Collection__Gakkou_ga_Kowai;https://cdn.myanimelist.net/resources/mxj_panel/2023/20230201162310_20230214_readthismanga-2023-2.png;My Dread is School!, School is Dreadful! Kanako Inuki Shout Collection;犬木加奈子絶叫コレクション 学校がこわい!;OVA;1;Finished Airing;Aug 6, 1999;['Kadokawa Shoten', 'Toei Video'];None found, add some;Toei Animation;Unknown;;40 min.;PG-13 - Teens 13 or older;5.54;#11524;#10525;1,964;4;;;[];"Based on the comic ""Inuki Kanako Queen's Collection"" by Inuki Kanako.  Bukida is disliked by all the students in his class because of his unpleasant face. However, he loves a girl named Matsuko and so he stalks her. Though Matsuko rejects him, Bukida fancies she likes him at heart. One day, Bukida is killed in a traffic accident. Matsuko feels relieved. But Bukida appeared to her as the living dead. Bukida says, ""I love you forever, even though I am dead!"".";;;;Horror;
56;Gakkou no Kowai Uwasa: Hanako-san ga Kita!!;https://myanimelist.net/anime/6472/Gakkou_no_Kowai_Uwasa__Hanako-san_ga_Kita;https://cdn.myanimelist.net/resources/mxj_panel/2023/20230201162310_20230214_readthismanga-2023-2.png;Here Comes Hanako, Scary Stories Of Your School: Here Comes Hanako, Phantom Of The Toilet;学校のコワイうわさ　花子さんがきた！！;TV;35;Finished Airing;Aug 15, 1994 to Dec 29, 1995;['Fuji TV', 'Amuse'];None found, add some;Group TAC;Unknown;;5 min. per ep.;PG-13 - Teens 13 or older;6.59;#6116;#10529;1,962;4;;;[];"Based on the short story ""Ghost Toilet"" from Toru Tsunemitsu's urban myth collection ""School Ghost Stories."" This was adapted into the children's book ""Hanako in the Toilet: Scary Stories of Your School"" (1993). Several artists then adapted this into the ""Here Comes Hanako"" manga; most of them also wrote the anime version, which was aired as a segment of the TV series ""Ponkikki Kids."" Episodes, introduced by Hanako, included ""The Haunted Cinema"" and ""The Cursed Promise Ring.""";Summer 1994;Not scheduled once per week;;Horror;
57;Youkai Ningen Bem;https://myanimelist.net/anime/4044/Youkai_Ningen_Bem;https://cdn.myanimelist.net/resources/mxj_panel/2023/20230201162310_20230214_readthismanga-2023-2.png;Yokai Ningen Bem, Demon-man Bem;妖怪人間ベム;TV;26;Finished Airing;Oct 7, 1968 to Mar 31, 1969;['None found', 'add some'];None found, add some;Dai-Ichi Douga;Original;;25 min. per ep.;PG-13 - Teens 13 or older;6.18;#8482;#10572;1,929;4;;;[];Three monsters, Bem, who looks like a gangster, Bero, who looks like a boy, and Bera, a witch, act as agents of justice, hoping that they will be allowed to become human. Several episodes involve them protecting a young boy. The style of animation is fairly distinctive, and the storylines not without interest.  (Source: AniDB);Fall 1968;Unknown;Mythology;Horror;
58;Ling Long: Incarnation Part 2;https://myanimelist.net/anime/42290/Ling_Long__Incarnation_Part_2;https://cdn.myanimelist.net/resources/mxj_panel/2023/20230201162310_20230214_readthismanga-2023-2.png;Spirit Cage: Incarnation 2nd Season, Ling Long: Incarnation 2nd Season;灵笼:INCARNATION 下半季;ONA;6;Finished Airing;Jul 31, 2020 to Oct 9, 2020;['bilibili'];None found, add some;YHKT Entertainment;Original;['Action', 'Drama', 'Horror', 'Sci-Fi', 'Suspense'];30 min. per ep.;R - 17+ (violence & profanity);7.25;#2795;#10594;1,915;18;;;[];Second half of Ling Long: Incarnation.;;;Mythology;;
59;Umi no Yami, Tsuki no Kage;https://myanimelist.net/anime/4484/Umi_no_Yami_Tsuki_no_Kage;https://cdn.myanimelist.net/resources/mxj_panel/2023/20230201162310_20230214_readthismanga-2023-2.png;Umi-Yami;海の闇、月の影;OVA;3;Finished Airing;Oct 14, 1989;['Movic'];None found, add some;Visual 80;Manga;['Drama', 'Horror', 'Romance'];30 min. per ep.;R - 17+ (violence & profanity);5.83;#10259;#10599;1,910;1;;Shoujo;[];Ruka and Rumi Kobayakawa are twin sisters in love with the same man, athletic upperclassman Katsuyuki Touma. Rumi seems supportive of Ruka's fledgling romance with Katsuyuki, until the twins are infected with a strange bacterium that transforms Rumi's personality and gifts the twins with terrifying psychic powers. Now Rumi will stop at nothing - or no one, that gets between her and Katsuyuki, including her own twin sister...  (Source: ANN);;;Super Power;;
