;title;link;image_link;synonyms;japanese;type;episodes;status;aired;premiered;broadcast;producers;licensors;studios;source;genres;themes;demographic;duration;rating;score;ranked;popularity;members;favorites;platforms;synopsis;theme;genre
86;Tokyo Majin Gakuen Kenpucho: Tou;https://myanimelist.net/anime/1860/Tokyo_Majin_Gakuen_Kenpucho__Tou;https://cdn.myanimelist.net/resources/mxj_panel/2023/20230201162310_20230214_readthismanga-2023-2.png;Tokyo Majin Gakuen Kenpuchou;東京魔人學園剣風帖　龖（トウ）;TV;14;Finished Airing;Jan 19, 2007 to Apr 20, 2007;Winter 2007;Fridays at 23:00 (JST);['Trinity Sound', 'Imagine'];ADV Films, Funimation;AIC Spirits, BeSTACK;Game;['Action', 'Drama', 'Fantasy', 'Horror', 'Supernatural'];['Martial Arts', 'School'];;24 min. per ep.;R - 17+ (violence & profanity);7.07;#3750;#2024;89,456;299;['Crunchyroll', 'Funimation'];"Something evil is stirring in the shadows of Tokyo...  During the spring of his senior year in high school, quiet Tatsuma Hiyuu transfers to Magami Academy in Shinjuku. The mysterious boy's ""outsider"" status and his profound skills in martial arts quickly earn him the friendship of class delinquent Kyouichi Houraiji. Through an uncanny connection and a happenstance challenge, he also meets Yuuya Daigo of the wrestling club, the captain of the girls' archery club, Komaki Sakurai, and Aoi Misato, the Student Council President.  During their encounter, there is a sudden, harsh disruption of the Ryumyaku (literally Dragon Pulse, otherwise known as Dragon Vein or Dragon Stream), the flow of arcane energy. The surge awakens within the five teenagers a latent power, giving them each a supernatural ability. Enlightened to their newly acquired gifts by Hisui, the young heir of the Kisaragi Clan who maintains his family's antiques shop - as well as their duty to protect Tokyo from Oni (demons) - the Magami students decide to use their power to protect the city from the onslaught of dark forces.  Battling the demons alongside Hisui Kisaragi, the five unlikely friends discover that they may have to face a greater threat to Tokyo other than destroying a few malevolent, random monsters. The Ryumyaku had been disrupted by force, from someone invoking the Dark Arts - and that person has a wicked desire to unleash a long-dead evil.  Can the teenagers overcome their own fears and flaws to fight against the Dark Arts? And soon they will also have to face their own destinies as they discover their Stars of Fate.  This anime is based on a manga, which was based on the Nintendo role-playing video game originally released in 1998.";;
87;Terra Formars: Revenge;https://myanimelist.net/anime/31430/Terra_Formars__Revenge;https://cdn.myanimelist.net/resources/mxj_panel/2023/20230201162310_20230214_readthismanga-2023-2.png;Terra Formars 2nd Season, Terraformars 2;テラフォーマーズ リベンジ;TV;13;Finished Airing;Apr 2, 2016 to Jun 25, 2016;Spring 2016;Saturdays at 01:05 (JST);['Warner Bros. Japan', 'Ultra Super Pictures', 'MAGES.', 'Good Smile Company', 'Shueisha', 'Kyoraku Industrial Holdings', 'Animatic'];VIZ Media;TYO Animations, LIDENFILMS;Manga;['Action', 'Horror', 'Sci-Fi'];['Gore', 'Space', 'Survival'];Seinen;24 min. per ep.;R - 17+ (violence & profanity);6.66;#5755;#2033;88,751;102;['Crunchyroll'];In Terra Formars Revenge, the crew members of the Annex I continue to fight against Terraformars—the large humanoid cockroaches that evolved from the ones sent to Mars centuries ago. However, far from discovering the cure for the lethal Alien Engine Virus that has been plaguing Earth, the Annex I team have learned that some squadrons have agendas from their own countries. Now, the squadrons must not only fight against the Terraformars for their survival, but also each other in the never-ending battle for international dominance.  [Written by MAL Rewrite];;
88;Sankarea: Wagahai mo... Zombie de Aru...;https://myanimelist.net/anime/16694/Sankarea__Wagahai_mo_Zombie_de_Aru;https://cdn.myanimelist.net/resources/mxj_panel/2023/20230201162310_20230214_readthismanga-2023-2.png;Sankarea Special, Sankarea Episode 13;さんかれあ 吾輩も... ゾンビである...;Special;1;Finished Airing;Nov 30, 2012;;;['Lantis', 'Pony Canyon', 'TBS', 'Kodansha', 'BS-TBS'];Funimation;Studio Deen;Manga;['Comedy', 'Horror', 'Romance', 'Supernatural', 'Ecchi'];;Shounen;24 min.;R+ - Mild Nudity;7.21;#3033;#2115;82,868;41;['Crunchyroll'];"Extra episode included on BD/DVD vol. 6; effectively episode 13.  Despite their decaying bodies, Rea’s zombie power comes in handy both at school and at home, and Babu gets interested in another cat—although this particular feline is one of the living.  (Source: FUNimation)";;
89;Vampire Hunter D;https://myanimelist.net/anime/732/Vampire_Hunter_D;https://cdn.myanimelist.net/resources/mxj_panel/2023/20230201162310_20230214_readthismanga-2023-2.png;;吸血鬼〈バンパイア〉ハンターD;Movie;1;Finished Airing;Dec 21, 1985;;;['Ajia-do', 'Trans Arts', 'Movic', 'Studio Kyuuma', 'Production Reed', 'Studio Core', 'CBS'];Sentai Filmworks, Urban Vision;Ashi Productions;Light novel;['Action', 'Horror', 'Sci-Fi', 'Supernatural'];;;1 hr. 20 min.;R+ - Mild Nudity;7.02;#3994;#2173;79,155;333;[];"10,000 years in the future, the world has become a very different place; monsters roam the land freely, and people, although equipped with high tech weapons and cybernetic horses, live a humble life more suited to centuries past. The story focuses on a small hamlet plagued by monster attacks and living under the shadow of rule by Count Magnus Lee, a powerful vampire lord who has ruled the land for thousands of years. When a young girl is bitten by the Count and chosen as his current plaything, she seeks out help of a quiet wandering stranger, D. It so happens that D is one of the world's best vampire hunters, and he takes it upon himself to cut through Magnus Lee's many minions, and put an end to the Count's rule.  (Source: AniDB)";Vampire;
90;Kaibutsu Oujo;https://myanimelist.net/anime/2130/Kaibutsu_Oujo;https://cdn.myanimelist.net/resources/mxj_panel/2023/20230201162310_20230214_readthismanga-2023-2.png;Kaibutsu Ohjo, Monster Princess;怪物王女;TV;25;Finished Airing;Apr 13, 2007 to Sep 28, 2007;Spring 2007;Fridays at 01:55 (JST);['Imagin', 'Lantis', 'Index', 'Universal Pictures Japan'];ADV Films, Sentai Filmworks;Madhouse;Manga;['Action', 'Comedy', 'Horror', 'Supernatural'];;Shounen;24 min. per ep.;PG-13 - Teens 13 or older;6.99;#4124;#2214;76,915;203;['HIDIVE'];"When Hiro Hiyorimi tries to save a beautiful young woman from certain death, he ends up a dead hero himself! However, since the drop-dead girl is Hime, daughter of the King of the Monsters, his ""reward"" is to come back as a not-quite-living soldier in her honor guard of horror! That means helping fight off the army of supernatural monstrosities Hime's siblings are unleashing against her in hopes of moving up the ladder of succession.  And if facing off with vampires and zombies isn't bad enough, how can anyone be prepared for the REALLY weird ones, like were-sharks, pandas and killer dumplings? This sure as hell isn't the afterlife Hiro was hoping for, but the really sad part is that Hime is the good girl in all of this... or at least as close to good as you can come when you're on the wrong side of the gates of hell!  (Source: RightStuf)";Vampire;
91;Blue Gender;https://myanimelist.net/anime/58/Blue_Gender;https://cdn.myanimelist.net/resources/mxj_panel/2023/20230201162310_20230214_readthismanga-2023-2.png;;BLUE GENDER;TV;26;Finished Airing;Oct 8, 1999 to Mar 31, 2000;Fall 1999;Thursdays at 01:55 (JST);['Youmex', 'Toshiba EMI'];Funimation;AIC;Original;['Adventure', 'Drama', 'Horror', 'Romance', 'Sci-Fi'];['Mecha', 'Military', 'Space'];;23 min. per ep.;R+ - Mild Nudity;7.03;#3963;#2215;76,897;403;[];Blue Gender takes place in the not too distant future in a world where things have gone terribly wrong for humanity. Humans have been replaced at the top of the food chain by the Blue, a race of bug-like aliens that have colonized Earth and pushed humans aside. A space station, Second Earth, has been constructed as a safe haven for humans, with the hope of one day reclaiming the Earth once more.  Yuji Kaido was cryogenically frozen, having been suffering from a disease known as B-Cells. Once awakened, he joins a team of soldiers that have come to Earth to extract him. Unfortunately, nothing goes according to plan as they make their way back to Second Earth.  Yuji will have to deal with the horrors of fighting a bloody war as he and the fighters from Second Earth look to survive. Will they be able to win back Earth without losing their humanity?;;
92;JoJo no Kimyou na Bouken: Adventure;https://myanimelist.net/anime/665/JoJo_no_Kimyou_na_Bouken__Adventure;https://cdn.myanimelist.net/resources/mxj_panel/2023/20230201162310_20230214_readthismanga-2023-2.png;JoJo's Bizarre Adventure (2000);ジョジョの奇妙な冒険 ADVENTURE;OVA;7;Finished Airing;May 25, 2000 to Jan 25, 2002;;;['Shueisha'];Super Techno Arts;APPP;Manga;['Adventure', 'Drama', 'Fantasy', 'Horror', 'Supernatural'];;Shounen;30 min. per ep.;R+ - Mild Nudity;7.21;#3058;#2218;76,720;341;['Funimation'];"Kujo Jotaro is a normal, popular Japanese high-schooler, until he thinks that he is possessed by a spirit, and locks himself in prison. After seeing his grandfather, Joseph Joestar, and fighting Joseph's friend Muhammad Abdul, Jotaro learns that the ""Spirit"" is actually Star Platinum, his Stand, or fighting energy given a semi-solid form. Later, his mother gains a Stand, and becomes sick. Jotaro learns that it is because the vampire Dio Brando has been revived 100 years after his defeat to Jonathan Joestar, Jotaro's great-great-grandfather. Jotaro decides to join Joseph and Abdul in a trip to Egypt to defeat Dio once and for all.";Vampire;
93;Evil or Live;https://myanimelist.net/anime/36245/Evil_or_Live;https://cdn.myanimelist.net/resources/mxj_panel/2023/20230201162310_20230214_readthismanga-2023-2.png;Lixiang Jinqu;EVIL OR LIVE;TV;12;Finished Airing;Oct 11, 2017 to Jan 2, 2018;Fall 2017;Wednesdays at 01:41 (JST);['Emon'];None found, add some;Haoliners Animation League;Web manga;;['Gore', 'Psychological', 'School', 'Survival'];;23 min. per ep.;R - 17+ (violence & profanity);5.79;#10431;#2219;76,714;109;['Crunchyroll'];Severe internet addiction has become an epidemic infecting the nation's youth, ultimately resulting in their extreme dependence on the world wide web. Those who are too far gone are enrolled at Elite Reeducation Academy in order to help them grow into successful adults. Hibiki is one such teenager who awakens in the facility unaware of how he came to be there. He learns from the head instructor that he was knocked out and brought to the school at his mother's behest, concerned with how belligerent her son was becoming as a result of his internet addiction.  Stuck in a place more akin to a prison than an academy, and with no escape from the abuses of the instructors, Hibiki decides to end his life by jumping from the roof. But as fate would have it, he meets a mysterious man named Shin who promises to give his life meaning...  [Written by MAL Rewrite];;Horror
94;Tasogare Otome x Amnesia: Taima Otome;https://myanimelist.net/anime/14189/Tasogare_Otome_x_Amnesia__Taima_Otome;https://cdn.myanimelist.net/resources/mxj_panel/2023/20230201162310_20230214_readthismanga-2023-2.png;Dusk Maiden of Amnesia: Exorcism Maiden, Tasogare Otome x Amnesia Special;黄昏乙女×アムネジア 退魔乙女;Special;1;Finished Airing;Nov 28, 2012;;;['None found', 'add some'];Sentai Filmworks;SILVER LINK.;Manga;['Horror', 'Mystery', 'Romance', 'Supernatural'];;Shounen;24 min.;R - 17+ (violence & profanity);7.50;#1734;#2221;76,627;107;['HIDIVE'];Tired of Yuuko's antics for causing more ghost stories to be spread amongst the students, Kirie challenges her to a series of games which if Yuuko loses, she must behave.  (Source: Wikipedia);School;
95;Shikabane Hime: Kuro;https://myanimelist.net/anime/5034/Shikabane_Hime__Kuro;https://cdn.myanimelist.net/resources/mxj_panel/2023/20230201162310_20230214_readthismanga-2023-2.png;Shikabane Hime Second Season;屍姫 玄;TV;12;Finished Airing;Jan 1, 2009 to Mar 26, 2009;Winter 2009;Unknown;['Square Enix', 'Starchild Records'];Funimation;Gainax, feel.;Manga;['Action', 'Horror', 'Supernatural'];;Shounen;24 min. per ep.;R - 17+ (violence & profanity);7.27;#2719;#2258;74,650;117;['Funimation'];A direct continuation of Shikabane Hime: Aka, taking place six months after Tagami Keisei's death at the hands of the Shichisei (Seven Stars), a group of elite Shikabane who act on more than just regrets. As per Keisei's dying wish, Kagami Ouri formed a temporary contract with Makina to save her from degenerating into a Shikabane. Since then, Ouri's been training to become a proper monk so that he can remain contracted to Makina and help her fight against the Shichisei -- the ones who originally killed Makina, the entire Hoshimura family, and now Keisei. However, the traitorous monk Shishidou Akasha has sided with the Shichisei in an attempt to destroy all Shikabane Hime and the entire monk organization that uses them -- Kougon Sect.;;
96;Ookamikakushi;https://myanimelist.net/anime/7079/Ookamikakushi;https://cdn.myanimelist.net/resources/mxj_panel/2023/20230201162310_20230214_readthismanga-2023-2.png;Wolfed Away;おおかみかくし;TV;12;Finished Airing;Jan 8, 2010 to Mar 26, 2010;Winter 2010;Fridays at 01:59 (JST);['TBS', 'flying DOG'];Sentai Filmworks;AIC;Visual novel;['Action', 'Horror', 'Mystery', 'Supernatural'];;;24 min. per ep.;PG-13 - Teens 13 or older;6.31;#7758;#2309;71,636;85;['HIDIVE'];"Due to his father's job, 15-year-old Hiroshi Kuzumi and his family move to the mountain town of Jouga. While some teenagers might have to worry about fitting in or feel out of place in a new environment, Hiroshi is welcomed enthusiastically at school by most of his new classmates. In fact, it seems like they just can't get enough of him, and he makes two friends rather quickly: the clingy and overly-affectionate Isuzu Tsumuhana, who is also his neighbor; and Kaname Asagiri, who also recently moved to Jouga. All in all, Hiroshi's new life seems to be quite normal—until people start disappearing.  Hiroshi is told that the missing townsfolk have simply moved away or suddenly transferred, but he can't shake the feeling that something is wrong. Meanwhile, in the dead of night under a red moon, masked individuals led by a girl with a scythe stalk their prey in the darkened streets of Jouga. Who are they, and are any of the residents safe from their wrath?  [Written by MAL Rewrite]";;
97;Ayakashi: Japanese Classic Horror;https://myanimelist.net/anime/586/Ayakashi__Japanese_Classic_Horror;https://cdn.myanimelist.net/resources/mxj_panel/2023/20230201162310_20230214_readthismanga-2023-2.png;Ayakashi - Samurai Horror Tales;怪～ayakashi～ Japanese Classic Horror;TV;11;Finished Airing;Jan 13, 2006 to Mar 24, 2006;Winter 2006;Unknown;['Dentsu', 'SKY Perfect Well Think', 'Fuji TV', 'Asmik Ace', 'Sony Music Entertainment'];Discotek Media, Geneon Entertainment USA;Toei Animation;Other;['Fantasy', 'Horror', 'Mystery'];['Adult Cast', 'Historical'];;23 min. per ep.;R - 17+ (violence & profanity);7.39;#2153;#2318;71,354;266;[];"A collection of three classic Japanese horror stories: ""Yotsuya Kaidan"", the story of a wife betrayed by her husband who seeks vengeance even in death. ""Tenshu Monogatari"", the story of forbidden love between a goddess and a human, and ""Bakeneko"", the story of a mysterious cat monster with a vendetta against a certain family.";;
98;Kemonozume;https://myanimelist.net/anime/1454/Kemonozume;https://cdn.myanimelist.net/resources/mxj_panel/2023/20230201162310_20230214_readthismanga-2023-2.png;The Beast Claw;ケモノヅメ;TV;13;Finished Airing;Aug 6, 2006 to Nov 5, 2006;Summer 2006;Sundays at 00:30 (JST);['WOWOW', 'Imagine'];None found, add some;Madhouse;Original;['Action', 'Horror', 'Romance', 'Supernatural'];;;23 min. per ep.;R+ - Mild Nudity;7.35;#2315;#2324;71,180;445;[];Creatures known as Shokujinki have been secretly living alongside humans for hundreds of years. Though they may look like humans, Shokujinki are able to transform into uncontrollable beasts with gigantic claws and consume humans to survive. The equally secretive Kifuuken dojo specializes in killing Shokujinki by cutting off their arms, and is the only force preventing unchecked Shokujinki domination.  Toshihiko Momota, the son of the leader of the Kifuuken, is instantly charmed by a mysterious woman named Yuka Kamitsuki. Their relationship is complicated, however, because unbeknownst to them both, Yuka is a Shokujinki and Toshihiko is sworn to kill her. Meanwhile, the Kifuuken is having a crisis of confidence as Toshihiko's brother Kazuma pushes against tradition and tries to modernize the Kifuuken. As emotions are strained and the secrets of both the past and present are revealed, who will live, and who will be eaten?  [Written by MAL Rewrite];Mythology;
99;Cossette no Shouzou;https://myanimelist.net/anime/514/Cossette_no_Shouzou;https://cdn.myanimelist.net/resources/mxj_panel/2023/20230201162310_20230214_readthismanga-2023-2.png;Le Portrait de Petite Cossette;コゼットの肖像;OVA;3;Finished Airing;Apr 11, 2004 to Dec 22, 2004;;;['Aniplex', 'Studio Hibari'];Sentai Filmworks, Geneon Entertainment USA;Daume;Original;['Drama', 'Horror', 'Romance', 'Supernatural'];['Gore', 'Psychological', 'Visual Arts'];;36 min. per ep.;R - 17+ (violence & profanity);6.80;#4984;#2372;68,652;384;[];Eiri Kurahashi is a Japanese art student who works in an antique shop. His friends begin to notice a dramatic, and rather concerning, change in Eiri, as he becomes more absent-minded and his behavior completely changes. They quickly decide to blame their friend's troubles on a girl.  They may be right, however, as Eiri has begun seeing a beautiful, doll-like girl trapped within an antique Venetian glass that his uncle bought in France. She seems to be living in a strange other world, contained entirely inside this glass, but her image refuses to leave Eiri's mind. His sketchbook becomes filled with her likeness, and he realizes he has become completely infatuated with this strange little girl. When he recognizes her in a portrait by the mysterious Italian artist, Marchello Orlando, he learns her name is Cossette d’Auvergne, and that she was tragically murdered along with the rest of her family.  One night, as he closes up the shop, he hears a voice asking him not to leave. Finally making contact with the object of his obsession, he makes a deal that he doesn't fully understand.  [Written by MAL Rewrite];;
0;Shiki Specials;https://myanimelist.net/anime/10083/Shiki_Specials;https://cdn.myanimelist.net/resources/mxj_panel/2023/20230201162310_20230214_readthismanga-2023-2.png;Corpse Demon Specials;屍鬼;Special;2;Finished Airing;May 25, 2011 to Jun 22, 2011;['Aniplex'];Funimation;Daume;Manga;['Horror', 'Mystery', 'Supernatural', 'Suspense'];['Gore', 'Psychological', 'Vampire'];Shounen;23 min. per ep.;R - 17+ (violence & profanity);7.76;#1007;#2378;68,490;82;[];"As the epidemic terrorizes the quiet secluded village of Sotoba, three women have found themselves amidst the escalating crisis. Nao Yasumori is tormented by visions of the deceased; Kanami Yano must keep a secret at risk of losing a loved one; and Motoko Maeda goes through insurmountable grief as the mysterious illness spreads throughout her family.  With rising tensions testing the limits of family relationships, even the smallest of mistakes can easily sever the ties that bind .  [Written by MAL Rewrite]";;;;
1;Higurashi no Naku Koro ni Kaku: Outbreak;https://myanimelist.net/anime/16700/Higurashi_no_Naku_Koro_ni_Kaku__Outbreak;https://cdn.myanimelist.net/resources/mxj_panel/2023/20230201162310_20230214_readthismanga-2023-2.png;When They Cry - Outbreak, Higurashi: When They Cry - Outbreak;ひぐらしのなく頃に拡〜アウトブレイク〜;OVA;1;Finished Airing;Aug 15, 2013;['Geneon Universal Entertainment', 'Frontier Works', 'Sotsu', 'Daiichi Shokai'];None found, add some;Studio Deen;Visual novel;['Horror', 'Mystery', 'Suspense'];['Gore', 'Psychological'];;52 min.;R - 17+ (violence & profanity);7.21;#3055;#2407;67,366;103;[];It is 1983, and Hinamizawa is under quarantine. A mysterious and deadly virus has been discovered within the small village, and its residents—such as teenager Keiichi Maebara and his friends Mion Sonozaki and Rena Ryuuguu—are left confused and frightened by the situation.  As the villagers begin to search for a way to stop the affliction from spreading, some make drastic plans, which leaves Keiichi and his friends looking for a way to escape the village. But when tensions reach an all-time high, some of his group may not make it out unscathed as they fight for their lives against enemies both seen and unseen.  [Written by MAL Rewrite];;;;
2;JoJo no Kimyou na Bouken: Phantom Blood;https://myanimelist.net/anime/3603/JoJo_no_Kimyou_na_Bouken__Phantom_Blood;https://cdn.myanimelist.net/resources/mxj_panel/2023/20230201162310_20230214_readthismanga-2023-2.png;JoJo's Bizarre Adventure: Phantom Blood;ジョジョの奇妙な冒険 ファントム ブラッド;Movie;1;Finished Airing;Feb 17, 2007;['Bandai'];None found, add some;APPP;Manga;['Action', 'Adventure', 'Horror'];;Shounen;1 hr. 30 min.;R - 17+ (violence & profanity);7.71;#1138;#2452;65,105;605;[];An adaptation of the original five volume arc of the popular JoJo's Bizarre Adventure manga, covering the Phantom Blood chapters. Jonathan Joestar is an aristocratic boy whose life is suddenly turned upside down by a mysterious new boy who arrives, Dio Brando. Dio has a connection to his father, and over time, a rivalry forms as Dio becomes obsessed with a mysterious, ancient, and mystical stone mask that Jonathan's father keeps.;Vampire;;;
3;Gibiate;https://myanimelist.net/anime/40074/Gibiate;https://cdn.myanimelist.net/resources/mxj_panel/2023/20230201162310_20230214_readthismanga-2023-2.png;;ジビエート;TV;12;Finished Airing;Jul 15, 2020 to Sep 30, 2020;['Nexon', 'Age Global Networks', 'Forecast Communications', 'Crunchyroll'];None found, add some;Studio Elle, l-a-unch・BOX;Original;['Action', 'Fantasy', 'Horror'];['Martial Arts', 'Samurai'];;24 min. per ep.;R - 17+ (violence & profanity);3.81;#13699;#2462;64,824;54;['Crunchyroll', 'Netflix'];"The story takes place in Japan. The year is 2030 and Earth has been completely overrun by a viral disease named ""Gibia"" that turns infected people into various different monsters, based on their age, sex, and race.  A samurai and a ninja from the early Edo period travel together through time and arrive in a ruined Japan to aid a professor working on a cure for the virus.  Together, they fight countless Gibia monsters, outlaws, and other fierce foes on their journey to save mankind.";;Summer 2020;Wednesdays at 22:00 (JST);
4;Hametsu no Mars;https://myanimelist.net/anime/413/Hametsu_no_Mars;https://cdn.myanimelist.net/resources/mxj_panel/2023/20230201162310_20230214_readthismanga-2023-2.png;;破滅のマルス;OVA;1;Finished Airing;Jul 6, 2005;['Idea Factory', 'King Records', 'Design Factory'];None found, add some;WAO World;Visual novel;['Horror', 'Sci-Fi'];;;19 min.;R - 17+ (violence & profanity);2.22;#13763;#2463;64,786;292;[];"Several months after a probe returning from Mars burns up during reentry, strange creatures dubbed ""Ancients"" begin to appear throughout Tokyo. Aggressive and dangerous, they cannot be killed with ordinary weapons. As scientists struggle to find the cause of their sudden appearance, the monsters wreak havoc across the world.  Humanity finds hope in the form of the MARS suit—a new weapon developed to take down these enemies. The suit, however, can only be worn by those with specific DNA. Enter Takeru Hinata, an ordinary teen with a troubled past and one of the few capable of piloting the only weapon against the Ancients. With the help of the AAST, a special police force established to defeat the dangerous creatures, the young man battles against demons both personal and global whilst trying to discover the true nature of Earth's new aggressors.  [Written by MAL Rewrite]";;;;
5;Petshop of Horrors;https://myanimelist.net/anime/326/Petshop_of_Horrors;https://cdn.myanimelist.net/resources/mxj_panel/2023/20230201162310_20230214_readthismanga-2023-2.png;;Pet Shop of Horrors (ペットショップ・オブ・ホラーズ);TV;4;Finished Airing;Mar 2, 1999 to Mar 23, 1999;['Trans Arts', 'TBS'];Sentai Filmworks, Urban Vision;Madhouse;Manga;['Horror', 'Mystery', 'Supernatural'];;Josei;23 min. per ep.;R - 17+ (violence & profanity);7.24;#2860;#2488;63,884;397;['HIDIVE'];"Count D, a quite interesting pet shop owner from an area called Chinatown, sells rare and hard to come by pets to people longing for something special, but with each sale comes a contract. If the rules of the contract are followed, everything goes fine, but if someone should break the rules of the contract, the pet shop cannot be held responsible for anything unfortunate that might happen. Leon Orcot, a homicide detective, has linked many odd and unexplainable deaths together; they all were customers of Count D's pet shop, and he intends to find out why.  (Source: ANN)";;Winter 1999;Unknown;
