;title;link;image_link;synonyms;japanese;type;episodes;status;aired;premiered;broadcast;producers;licensors;studios;source;genres;themes;demographic;duration;rating;score;ranked;popularity;members;favorites;platforms;synopsis;theme;genre
97;Aru Zombie Shoujo no Sainan;https://myanimelist.net/anime/37735/Aru_Zombie_Shoujo_no_Sainan;https://cdn.myanimelist.net/resources/mxj_panel/2023/20230201162310_20230214_readthismanga-2023-2.png;The Misfortune of a Certain Zombie Girl, Calamity of a Zombie Girl;あるゾンビ少女の災難;ONA;1;Finished Airing;Jul 4, 2018;['None found', 'add some'];None found, add some;Gonzo, Stingray;Light novel;['Action', 'Horror', 'Supernatural', 'Suspense'];;;1 hr. 19 min.;R+ - Mild Nudity;5.33;#12240;#5251;13,453;13;['Crunchyroll'];"On a hot summer day, five university students sneak into the library storage to look for some treasure. They find two sets of female antique mummies from Italy around the age of 14–20 years old.  One of the students, Sayaka, rips open the mummy and takes out a stone called ""stone of life,"" which gave the mummies super strength and eternal life. Having stolen their ""stone of life,"" the two mummy girls wake up and become zombies after 100 years in order to get it back in a bloody gruesome way, smashing their heads and eating their flesh for power.  The only way for the students to get out is to somehow find a way to kill the zombie girls. Will they be able to survive?  (Source: Shochiku)";Gore;;;
98;Ushio to Tora;https://myanimelist.net/anime/842/Ushio_to_Tora;https://cdn.myanimelist.net/resources/mxj_panel/2023/20230201162310_20230214_readthismanga-2023-2.png;Ushio & Tora;うしおととら;OVA;10;Finished Airing;Sep 11, 1992 to Aug 1, 1993;['OB Planning', 'Toshiba EMI', 'Toho', 'Shogakukan'];ADV Films;Pastel;Manga;['Action', 'Comedy', 'Horror'];;Shounen;30 min. per ep.;PG-13 - Teens 13 or older;7.15;#3336;#5253;13,443;38;[];Ushio thinks his father's tale of an ancient ancestor impaling a demon on a temple altar stone with the legendary Beast Spear is nuts, but when he finds the monster in his own basement, Ushio has to take another look at the family legend! Fortunately, Ushio knows it's best to let sleeping dogs lie and leave captured demons where they are. Unfortunately, the release of the monster's evil energies begins to beckon other demons to Ushio's hometown! To save his friends and family from the invading spirits, Ushio is forced to release Tora from his captivity. But will the cure prove to be worse than the curse? Will Ushio end his life a Tora-snack? Or will the Beast Spear keep Tora in line long enough to save the city?  (Source: AniDB);;;;
99;Neo Ranga;https://myanimelist.net/anime/1163/Neo_Ranga;https://cdn.myanimelist.net/resources/mxj_panel/2023/20230201162310_20230214_readthismanga-2023-2.png;Nankai Kio Neoranga, Strange World of the South Seas - Neoranga;南海奇皇ネオランガ;TV;48;Finished Airing;Apr 6, 1998 to Sep 28, 1999;['Pony Canyon', 'Marubeni'];ADV Films;Pierrot;Original;['Adventure', 'Horror'];;;15 min. per ep.;PG-13 - Teens 13 or older;6.58;#6146;#5254;13,425;26;[];An ancient God called Ranga awakens on an isolated island in the South Pacific where it has been slumbering forgotten by mankind. Three sisters living in Tokyo—Minami, Ushio, and Yuuhi Shimabara—discover they have inherited this Island Kingdom, along with the huge God. When Ranga shows up in Tokyo, it soon becomes a source of wonder and conflict for the three sisters that control Ranga, the people who want to destroy it, and ones who want to use it.  (Source: ANN);Mecha;Spring 1998;Mondays at 19:00 (JST);
0;Kishin Douji Zenki;https://myanimelist.net/anime/1573/Kishin_Douji_Zenki;https://cdn.myanimelist.net/resources/mxj_panel/2023/20230201162310_20230214_readthismanga-2023-2.png;Legend of Zenki, Demon Prince Zenki;鬼神童子ZENKI;TV;51;Finished Airing;Jan 9, 1995 to Dec 25, 1995;Winter 1995;Mondays at 18:00 (JST);['TV Tokyo', 'Kitty Films', 'Yomiuri Advertising', 'K-Factory'];Media Blasters;Studio Deen;Manga;['Action', 'Comedy', 'Drama', 'Fantasy', 'Horror', 'Ecchi'];Shounen;24 min. per ep.;PG-13 - Teens 13 or older;6.95;#4261;#5262;13,384;30;;[];In ancient times, a great battle was waged between a master mage, Enno Ozuno, and an evil demon goddess, Karuma. Unfortunately, Enno didn't have the strength to defeat her alone and was forced to call upon Zenki, a powerful protector demon. After Karuma was defeated, Enno sealed Zenki away in a pillar located inside his temple.  1,200 years after this epic battle, Enno's descendant, Chiaki, spends her days showing tourists around her hometown of Shikigami-cho and doing exorcisms to pay the bills. One day, two thieves enter the town in hopes of opening a seal in the Ozuno temple and releasing the hidden treasure from within. However, what actually pops out is a dark entity that attaches itself to the henchmen, transforming them into demonic beings. After this transformation, they begin a rampage through the temple, terrorizing poor Chiaki.  It is now up to this young progeny to unleash her family's powers to summon Zenki and save Shikigami-cho from these demons, as well as the evil entities sure to follow in their footsteps.;;
1;Kyoushoku Soukou Guyver (1989);https://myanimelist.net/anime/6016/Kyoushoku_Soukou_Guyver_1989;https://cdn.myanimelist.net/resources/mxj_panel/2023/20230201162310_20230214_readthismanga-2023-2.png;Bio-Booster Armor Guyver, The Guyver, Гайвер, Guyver: The Bio-boosted Armor;強殖装甲ガイバー;OVA;6;Finished Airing;Sep 25, 1989 to Feb 25, 1990;;;['animate Film'];Manga Entertainment;Visual 80;Manga;['Action', 'Horror', 'Sci-Fi'];;29 min. per ep.;PG-13 - Teens 13 or older;7.10;#3592;#5289;13,201;108;;[];"Shou and his friend, Tetsurou, stumble upon a strange orb-like mechanism, the Guyver Unit, in the woods. It physically bonds with Shou and turns him into the alien soldier, Guyver. His mission is to protect the Guyver Unit from the Japanese corporation known as Chronos. They are after it and two other units just like it. To retrieve the object, they send out vicious monsters known as Zoanoids. So no one is safe in Shou's life; not even himself.";Super Power;
2;Mononoke Movie;https://myanimelist.net/anime/52107/Mononoke_Movie;https://cdn.myanimelist.net/resources/mxj_panel/2023/20230201162310_20230214_readthismanga-2023-2.png;Gekijouban Mononoke;劇場版モノノ怪;Movie;1;Not yet aired;2023;;;['Twin Engine'];None found, add some;None found, add some;Original;['Fantasy', 'Horror', 'Mystery', 'Supernatural'];;Unknown;R - 17+ (violence & profanity);N/A;N/A;#5296;13,161;48;['Adult Cast', 'Historical', 'Mythology', 'Psychological'];[];No synopsis information has been added to this title. Help improve our database by adding a synopsis here.;;
3;Kaibutsu Oujo (OVA);https://myanimelist.net/anime/9159/Kaibutsu_Oujo_OVA;https://cdn.myanimelist.net/resources/mxj_panel/2023/20230201162310_20230214_readthismanga-2023-2.png;Kaibutsu Ohjo, Monster Princess, Princess Resurrection (OVA);怪物王女;OVA;3;Finished Airing;Dec 9, 2010 to Oct 7, 2011;;;['None found', 'add some'];None found, add some;Tatsunoko Production;Manga;['Action', 'Comedy', 'Horror', 'Supernatural'];Shounen;22 min. per ep.;R - 17+ (violence & profanity);7.04;#3918;#5361;12,729;13;;['HIDIVE'];Based on a manga by Mitsunaga Yasunori, serialised in Monthly Shounen Sirius.  Hiyorimi Hiro moves to a new city to live with his older sister, but dies before he can find her. He then awakens to a new life as a servant of a Princess of the Monster Realm, who just happens to be employing his sister. Monsters soon appear to attack or pester the princess since she is in line for the royal throne, and Hiro must protect her with his life (and repeated deaths).  (Soure: ANN);;
4;Violence Jack: Harlem Bomber-hen;https://myanimelist.net/anime/1341/Violence_Jack__Harlem_Bomber-hen;https://cdn.myanimelist.net/resources/mxj_panel/2023/20230201162310_20230214_readthismanga-2023-2.png;Violence Jack: Harlem Bomber, Violence Jack: Slum King, Violence Jack: Harlem Bomber Hen, Violence Jack: Harlem Bomber Arc;バイオレンス ジャック 〜ハーレム・ボンバー編〜;OVA;1;Finished Airing;Jun 5, 1986;;;['Dynamic Planning', 'Soeishinsha'];Discotek Media;Ashi Productions;Manga;['Action', 'Drama', 'Horror'];;37 min.;R+ - Mild Nudity;5.19;#12616;#5460;12,076;14;;[];"Kanto Hell Earthquake has demolished the metropolitan completely. After the earthquake, Slum King is kidnapping girls and sell them as sex slaves. Mari is wandering on the devastated field looking for her lover, Ken. But she is also kidnapped by them. While she is tortured and trained as a sex slave, Ken saves her. Ken has become the member of Slum King. The king offers condition to him; in return for releasing her, he has to kill Violence Jack.  (Source: AniDB)";Gore;
5;Litchi DE Hikari Club;https://myanimelist.net/anime/15045/Litchi_DE_Hikari_Club;https://cdn.myanimelist.net/resources/mxj_panel/2023/20230201162310_20230214_readthismanga-2023-2.png;Litchi☆Hikari Club, Raichi Hikari Club;ライチ DE 光クラブ;TV;8;Finished Airing;Oct 2, 2012 to Nov 20, 2012;Fall 2012;Unknown;['Nelke Planning'];None found, add some;Kachidoki Studio;Manga;['Comedy', 'Drama', 'Horror', 'Romance'];;3 min. per ep.;PG-13 - Teens 13 or older;5.17;#12664;#5473;11,992;16;;['Crunchyroll'];"Litchi DE Hikari Club takes place in an alternate reality where the Hikari Club does not fall into disarray after the completion of Litchi, the intelligent humanlike robot the club invented to kidnap girls.  The cult-like Hikari Club has had its ups and downs. Led by the enigmatic, beauty-obsessed Hiroyuki ""Zera"" Tsunekawa, the club has finally succeeded in using their fruit-powered robot, Litchi, to kidnap the beautiful Kanon. After accomplishing their goals, the Hikari Club has little to do other than delight in their newfound lives. From selling the technology that allows Litchi to run on lychee fruit, to modifying the robot to perform different tasks, there's no telling what antics the Hikari Club will get up to next!  [Written by MAL Rewrite]";Psychological;
6;Mamono Hunter Youko;https://myanimelist.net/anime/1280/Mamono_Hunter_Youko;https://cdn.myanimelist.net/resources/mxj_panel/2023/20230201162310_20230214_readthismanga-2023-2.png;Demon Hunter Youko, Mamono Hunter Yohko;魔物ハンター妖子;OVA;5;Finished Airing;Dec 1, 1990 to Jul 1, 1995;;;['Toho'];ADV Films;Madhouse;Original;['Comedy', 'Fantasy', 'Horror', 'Supernatural'];;36 min. per ep.;R+ - Mild Nudity;6.23;#8200;#5547;11,642;26;;[];Yohko Mono is a regular girl making her way through high school--until she learns that she is the 108th successor to a line of warriors charged with defending the earth against demons. Eventually she must fight her ultimate battle against the demon who started it all.  (Source: ANN);;
7;Himekishi Lilia;https://myanimelist.net/anime/3992/Himekishi_Lilia;https://cdn.myanimelist.net/resources/mxj_panel/2023/20230201162310_20230214_readthismanga-2023-2.png;Princess Knight Lilia;姫騎士リリア;OVA;6;Finished Airing;Jun 2, 2006 to Jul 30, 2010;;;['Pixy'];None found, add some;Anime Antenna Iinkai;Visual novel;['Fantasy', 'Horror', 'Supernatural', 'Hentai'];;27 min. per ep.;Rx - Hentai;6.74;N/A;#5576;11,517;106;;[];The princess knight Lilia Evelvine is set to succeed her father as the ruler of the Leuven kingdom, but her jealous brother, Dirk, will do anything to halt her ascension to the throne. With the aid of Kiriko, his court enchantress, and Sand, the servant of the King of Demons, the dastardly prince enacts a coup to gain control of the castle and become the next king. He succeeds, but not before being reminded of his agreement with Sand: to extract the holy energy within Lilia as a tribute to the King of Demons. Dirk then proceeds to corrupt his mother and Lilia with all sorts of perversions, hoping to fulfill his task on time while turning the two into his loyal slaves.  [Written by MAL Rewrite];Mythology;
8;Hakaba Kitarou;https://myanimelist.net/anime/3710/Hakaba_Kitarou;https://cdn.myanimelist.net/resources/mxj_panel/2023/20230201162310_20230214_readthismanga-2023-2.png;;墓場鬼太郎;TV;11;Finished Airing;Jan 11, 2008 to Mar 21, 2008;Winter 2008;Fridays at 00:45 (JST);['Dentsu', 'Yomiko Advertising', 'SKY Perfect Well Think', 'Fuji TV', 'Asmik Ace', 'Sony Music Entertainment', 'Fujipacific Music'];None found, add some;Toei Animation;Manga;['Horror', 'Supernatural'];;25 min. per ep.;PG-13 - Teens 13 or older;6.87;#4644;#5602;11,406;43;;[];Kitarou is a youkai boy born in a cemetery, and aside from his mostly-decayed father, the last living member of the Ghost tribe. He is missing his left eye, but his hair usually covers the empty socket. He fights for peace between humans and youkai, which generally involves protecting the former from the wiles of the latter.  This version of the Kitarou story is based on the original Hakaba Kitarou manga, the manga which inspired the popular Gegege no Kitarou series in the late 60's.  (Source: Wikipedia);;
9;Karakuri Zoushi Ayatsuri Sakon;https://myanimelist.net/anime/2204/Karakuri_Zoushi_Ayatsuri_Sakon;https://cdn.myanimelist.net/resources/mxj_panel/2023/20230201162310_20230214_readthismanga-2023-2.png;Ningyou Zoushi Ayatsuri Sakon, Puppet Master Sakon, Tales of Puppetmaster Sakon;人形草紙あやつり左近;TV;26;Finished Airing;Oct 8, 1999 to Mar 31, 2000;Fall 1999;Tuesdays at 18:30 (JST);['WOWOW'];None found, add some;TMS Entertainment;Manga;['Horror', 'Mystery', 'Suspense'];Shounen;25 min. per ep.;R - 17+ (violence & profanity);7.36;#2292;#5608;11,381;55;;[];The dark-haired bishounen is Sakon Tachibana, a puppeteer, and the other is Ukon, his favorite puppet, and best friend. Sakon is the (only) grandson of Saemon Tachibana, a national treasure of Japan famous for his manipulation of Bunraku puppets. Ukon is a child doll puppet made in the early Meiji era by the famous female dollmaker Unosuke. Together they run into murders and solve them.  (Source: AnimeNfo);;
10;Kaibutsu Oujo: Konsui Oujo;https://myanimelist.net/anime/4082/Kaibutsu_Oujo__Konsui_Oujo;https://cdn.myanimelist.net/resources/mxj_panel/2023/20230201162310_20230214_readthismanga-2023-2.png;Kaibutsu Oujo Special, Kaibutsu Oujo: Sleeping Princess, Princess Resurrection Special;怪物王女　第26話「昏睡王女」;Special;1;Finished Airing;Feb 14, 2008;;;['Lantis'];Sentai Filmworks;Madhouse;Manga;['Action', 'Comedy', 'Horror', 'Supernatural'];Shounen;23 min.;PG-13 - Teens 13 or older;6.96;#4230;#5622;11,298;14;;[];Episode 26 included in the ninth DVD volume of Kaibutsu Oujo.;Vampire;
11;Blue Gender: The Warrior;https://myanimelist.net/anime/1380/Blue_Gender__The_Warrior;https://cdn.myanimelist.net/resources/mxj_panel/2023/20230201162310_20230214_readthismanga-2023-2.png;;BLUE GENDER THE WARRIOR;Movie;1;Finished Airing;Nov 20, 2002;;;['None found', 'add some'];Funimation;AIC;Original;['Adventure', 'Drama', 'Horror', 'Romance', 'Sci-Fi'];;1 hr. 39 min.;R - 17+ (violence & profanity);6.21;#8304;#5677;11,016;7;['Mecha', 'Military', 'Space'];[];It is a time of chaos. Earth is no longer what it used to be. It has been infested with a bug like species called the Blue. 20 years ago Yuji Kaido, who has a mysterious disease, is put into suspended animation until a cure is found. When he wakes up Yuji learns that it’s been more than 20 years since he was put into suspended animation, and the world is now controlled by these creatures. He then decides to join a group of soldiers fighting against the Blue for hope of a better future.  (Source: ANN);;
12;Kakugo no Susume;https://myanimelist.net/anime/1647/Kakugo_no_Susume;https://cdn.myanimelist.net/resources/mxj_panel/2023/20230201162310_20230214_readthismanga-2023-2.png;;覚悟のススメ;OVA;2;Finished Airing;Oct 23, 1996 to Dec 18, 1996;;;['Victor Entertainment', 'Big West'];Media Blasters;Ashi Productions;Manga;['Action', 'Horror', 'Sci-Fi', 'Ecchi'];;37 min. per ep.;R+ - Mild Nudity;4.77;#13322;#5702;10,884;38;['Mecha', 'Mythology', 'Super Power'];[];A series of natural disasters has reduced the world to rubble, with the survivors doing whatever they must to survive in a world gone mad. But one young boy, Kakugo, gifted with amazing martial arts and a superpowerful suit of armor by his late father, has been charged with making the world (or at least his school) a safer place. But his sister has a matching set of skills and equipment, and she`s on a mission to bring peace to the world... by wiping out humanity!  (Source: AnimeNfo);;
13;Yami Shibai 9;https://myanimelist.net/anime/49110/Yami_Shibai_9;https://cdn.myanimelist.net/resources/mxj_panel/2023/20230201162310_20230214_readthismanga-2023-2.png;Yamishibai: Japanese Ghost Stories Ninth Season, Yamishibai: Japanese Ghost Stories 9;闇芝居 九期;TV;13;Finished Airing;Jul 12, 2021 to Sep 30, 2021;Summer 2021;Unknown;['None found', 'add some'];None found, add some;ILCA, DRAWIZ;Original;['Avant Garde', 'Horror', 'Supernatural'];;4 min. per ep.;PG-13 - Teens 13 or older;5.85;#10192;#5746;10,698;39;;['Crunchyroll', 'Bahamut Anime Crazy', '', ''];Ninth season of Yami Shibai.;;
14;Teizokurei Daydream;https://myanimelist.net/anime/1500/Teizokurei_Daydream;https://cdn.myanimelist.net/resources/mxj_panel/2023/20230201162310_20230214_readthismanga-2023-2.png;Teizoku Rei Daydream, Vulgar Ghost Daydream;低俗霊DAYDREAM;OVA;4;Finished Airing;Jun 25, 2004 to Dec 23, 2004;;;['Bandai Visual', 'Imagine'];Geneon Entertainment USA;Hal Film Maker;Manga;['Comedy', 'Drama', 'Horror', 'Supernatural', 'Ecchi'];;24 min. per ep.;R+ - Mild Nudity;6.12;#8845;#5774;10,570;13;;[];Saiki Misaki has been able to see ghosts since she was a kid. Now, working at an S&M club, her spare time goes to sending the spirits off to the other world by having to make them realize they're dead and have to leave. This would supposedly be a little bit easier if you didnt have a background of hardship and loneliness... and a perverted employer.  (Source: ANN);;
15;Violence Jack: Jigoku Gai-hen;https://myanimelist.net/anime/1342/Violence_Jack__Jigoku_Gai-hen;https://cdn.myanimelist.net/resources/mxj_panel/2023/20230201162310_20230214_readthismanga-2023-2.png;Violence Jack: Evil Town, Violence Jack Jigoku Gai, Violence Jack 2, Violence Jack: Jigoku Gai Hen, Violence Jack: Jigoku Gai Arc;バイオレンス ジャック 〜地獄街編〜;OVA;1;Finished Airing;Dec 6, 1988;;;['Dynamic Planning'];Discotek Media;Studio 88;Manga;['Action', 'Drama', 'Horror'];;58 min.;R+ - Mild Nudity;5.55;#11466;#5781;10,538;19;;[];The World as we know it has been torn apart shattered by a series of natural disasters that have turned civilization into a brutish nightmare of survival and has left whole cities buried beneath the Earth. It's now a lethal and chaotic place, a place where only the strongest and most savage remain alive. The strongest of them all is a giant warrior known as Violence Jack…  Violence Jack tries to avert a civil war brewing among the wretched inhabitants of a subterranean metropolis called Evil Town. Based on a character created by manga horror specialist, Go Nagai.  (Source: AniDB);Gore;
16;Call Me Tonight;https://myanimelist.net/anime/2147/Call_Me_Tonight;https://cdn.myanimelist.net/resources/mxj_panel/2023/20230201162310_20230214_readthismanga-2023-2.png;Pink Noise;コール・ミー・トゥナイト;OVA;1;Finished Airing;Jul 28, 1986;;;['None found', 'add some'];None found, add some;AIC;Original;['Comedy', 'Horror', 'Romance', 'Sci-Fi'];;30 min.;R+ - Mild Nudity;5.26;#12435;#5810;10,432;15;;[];Rumi's met a lot of guys through her job, and it's probably fair to assume that most of them could be said to have some sort of problem, but a man who literally turns into a beast when he gets turned on may be outside of this perky call girl's field of expertise. Still, a little challenge every now and again stimulates the mind and makes life so much more interesting, so she's willing to give it a shot.  (Source: AniDB);Gore;
17;Terra Formars: Earth-hen;https://myanimelist.net/anime/34532/Terra_Formars__Earth-hen;https://cdn.myanimelist.net/resources/mxj_panel/2023/20230201162310_20230214_readthismanga-2023-2.png;;テラフォーマーズ アース編;OVA;2;Finished Airing;Aug 17, 2018 to Nov 19, 2018;;;['Shueisha'];None found, add some;TYO Animations, LIDENFILMS;Manga;['Action', 'Horror', 'Sci-Fi'];Seinen;26 min. per ep.;R - 17+ (violence & profanity);6.11;#8872;#5821;10,396;7;['Gore', 'Space', 'Survival'];[];As the Mars expedition comes to an end, a small group of Terraformars manage to reach Earth and bring the fight there. Now the surviving members of the ANNEX-I along with new recruits, have to save Earth from the growing roach menace.  (Source: AniDB);;
18;Koroshiya 1 The Animation: Episode 0;https://myanimelist.net/anime/2346/Koroshiya_1_The_Animation__Episode_0;https://cdn.myanimelist.net/resources/mxj_panel/2023/20230201162310_20230214_readthismanga-2023-2.png;Koroshiya Ichi The Animation: Episode 0;殺し屋１ THE ANIMATION EPISODE 0;OVA;1;Finished Airing;Sep 27, 2002;;;['Shogakukan-Shueisha Productions', 'Amuse'];Central Park Media;AIC;Manga;['Action', 'Avant Garde', 'Drama', 'Horror'];Seinen;45 min.;R+ - Mild Nudity;5.62;#11190;#5842;10,287;29;['Martial Arts', 'Psychological'];[];A masochistic mobster meets his match in the dark streets of Tokyo. His nemesis, Ichi, is a psychopathic killer with an unrelenting thirst for bloodshed. A horrifying secret burns in his mind, and his hands deal death without mercy. At last, the shrouds of mystery are parted to reveal the origin of the monster. The city will know its greatest fear at the unveiling of Ichi the Killer.  (Source: ANN);;
19;Bem Movie: Become Human;https://myanimelist.net/anime/42129/Bem_Movie__Become_Human;https://cdn.myanimelist.net/resources/mxj_panel/2023/20230201162310_20230214_readthismanga-2023-2.png;;劇場版BEM 〜BECOME HUMAN〜;Movie;1;Finished Airing;Oct 2, 2020;;;['TV Tokyo', 'Pony Canyon', 'KlockWorx', 'flying DOG', 'Glovision', 'ADK'];None found, add some;Production I.G;Original;['Action', 'Horror', 'Supernatural'];;1 hr. 30 min.;None;6.79;#5035;#5863;10,171;13;;[];Take place 2 years after the last episode of the TV series.  Detective Sonia Summers are tracking Bem and the others. She reunited with Belo, who is fighting a dark organization alone. He brought her to Bem, but Bem doesn't remember anything and living in the city as an ordinary employee... or that is what he thought he was.;Mythology;
20;Maou Dante;https://myanimelist.net/anime/1628/Maou_Dante;https://cdn.myanimelist.net/resources/mxj_panel/2023/20230201162310_20230214_readthismanga-2023-2.png;Dante the Satan;魔王ダンテ;TV;13;Finished Airing;Aug 31, 2002 to Nov 23, 2002;Summer 2002;Unknown;['AT-X', 'Dynamic Planning'];Discotek Media, Geneon Entertainment USA;Magic Bus;Manga;['Action', 'Horror', 'Supernatural'];Shounen;24 min. per ep.;R - 17+ (violence & profanity);5.99;#9516;#5903;10,028;10;;[];While sleeping one night, Ryo Utsugi had a nightmare of monsters attacking him. One day he learns a mysterious power to let him hear voices and have visions of girls getting killed, but one night he hears the same voice.  (Source: ANN);Mythology;
21;Shihaisha no Tasogare;https://myanimelist.net/anime/1245/Shihaisha_no_Tasogare;https://cdn.myanimelist.net/resources/mxj_panel/2023/20230201162310_20230214_readthismanga-2023-2.png;;支配者の黄昏;OVA;1;Finished Airing;Jan 21, 1998;;;['Toei Video', 'Filmlink International'];Urban Vision;Madhouse;Manga;['Action', 'Drama', 'Horror', 'Sci-Fi', 'Supernatural'];Shoujo;45 min.;R+ - Mild Nudity;5.81;#10354;#5908;10,009;14;;[];"Since the beginning of time, monstrous Demons and noble Guardians have battled for Earth - the everlasting gift of the one great Mother, creator of all life. A deep hatred burns between Demon and Guardian; the Guardians prevented the Demons from destroying humanity and the world itself.  Eons later, Neo-Shinjuku City: few Demons or Guardians remain to continue their epic war. Humans rule the Earth, with no real memory of either Demons or Guardians. Yet deep within the dark underworld of the city, one supreme Demon is alive and plotting to subjugate mankind. Only one Guardian is left to do battle, and the fate of the human race is at stake.  Based on the Graphic Novel ""Twilight of the Dark Master (Shihaisha no Tasogare)"" (Shinshokan) by Saki Okuse  (Source: DVD Back Cover)";Mythology;
22;Darkside Blues;https://myanimelist.net/anime/1494/Darkside_Blues;https://cdn.myanimelist.net/resources/mxj_panel/2023/20230201162310_20230214_readthismanga-2023-2.png;;ダークサイド・ブルース;Movie;1;Finished Airing;Oct 8, 1994;;;['Akita Shoten'];None found, add some;J.C.Staff;Manga;['Horror', 'Mystery', 'Sci-Fi'];;1 hr. 23 min.;R+ - Mild Nudity;6.04;#9282;#5932;9,949;26;;[];"The Persona Century Corporation has purchased nearly every parcel of land on earth. Dissension is not tolerated within the corporation's borders and those who oppose Persona are dealt with swiftly. Of those few places not yet under Persona's control is the free town of Kabuki-cho, also known as ""The Dark Side of Tokyo"". Within the town, under the leadership of a woman named Mai, is a small resistance group called Messiah. Into this world steps a man who takes the sobriquet of Kabuki-cho: Darkside. Sealed up in another dimension eighteen years ago by Persona Century, Darkside now returns to aid Messiah using his unique mystic power of renewal.  (Source: ANN)";Psychological;
